03-01-2012,unknown,Status quo will not be disturbed at Ayodhya; says Vajpayee
04-01-2012,unknown,Fissures in Hurriyat over Pak visit
05-01-2012,unknown,America's unwanted heading for India?
06-01-2012,unknown,For bigwigs; it is destination Goa
09-01-2012,unknown,Extra buses to clear tourist traffic
10-01-2012,unknown,Dilute the power of transfers; says Riberio
11-01-2012,unknown,Focus shifts to teaching of Hindi
12-01-2012,unknown,IT will become compulsory in schools
13-01-2012,unknown,Move to stop freedom fighters' pension flayed
17-01-2012,unknown,Gilani claims he applied for passport 2 years ago
18-01-2012,unknown,Parivar dismisses PM's warning
19-01-2012,unknown,India; Pak exchange lists of N-plants
20-01-2012,unknown,Will Qureshi's return really help the govt?
23-01-2012,unknown,PM's tacit message: Put Ram tample on hold
24-01-2012,unknown,Text of the Prime Minister's article
25-01-2012,unknown,NCW to focus on violence against women
26-01-2012,unknown,BBC's reality TV will focus on AIIMS
27-01-2012,unknown,Jaitley firm on legal reforms
30-01-2012,unknown,Hoshangabad farmers have enough water
31-01-2012,unknown,BJP jumps into rail track conversion issue
01-02-2012,unknown,America's unwanted heading for India?
02-02-2012,unknown,State may take AP to court over Krishna
03-02-2012,unknown,This official has sued the briber
06-02-2012,unknown,Park turns temple compound as residents watch
07-02-2012,unknown,Moves afoot to evict squatters in Urban dist
08-02-2012,unknown,Mafia calls the shots in Gandhinagar too
09-02-2012,unknown,Status quo will not be disturbed at Ayodhya; says Vajpayee
10-02-2012,unknown,Fissures in Hurriyat over Pak visit
13-02-2012,unknown,America's unwanted heading for India?
14-02-2012,unknown,For bigwigs; it is destination Goa
15-02-2012,unknown,Extra buses to clear tourist traffic
16-02-2012,unknown,Dilute the power of transfers; says Riberio
17-02-2012,unknown,Focus shifts to teaching of Hindi
21-02-2012,unknown,IT will become compulsory in schools
22-02-2012,unknown,Move to stop freedom fighters' pension flayed
23-02-2012,unknown,Gilani claims he applied for passport 2 years ago
24-02-2012,unknown,Parivar dismisses PM's warning
27-02-2012,unknown,India; Pak exchange lists of N-plants
28-02-2012,unknown,Will Qureshi's return really help the govt?
29-02-2012,unknown,PM's tacit message: Put Ram tample on hold
01-03-2012,unknown,Text of the Prime Minister's article
02-03-2012,unknown,NCW to focus on violence against women
05-03-2012,unknown,BBC's reality TV will focus on AIIMS
06-03-2012,unknown,Jaitley firm on legal reforms
07-03-2012,unknown,Hoshangabad farmers have enough water
08-03-2012,unknown,BJP jumps into rail track conversion issue
09-03-2012,unknown,America's unwanted heading for India?
12-03-2012,unknown,State may take AP to court over Krishna
13-03-2012,unknown,This official has sued the briber
14-03-2012,unknown,Park turns temple compound as residents watch
15-03-2012,unknown,Moves afoot to evict squatters in Urban dist
16-03-2012,unknown,Mafia calls the shots in Gandhinagar too
19-03-2012,unknown,Come to Nandi Hills...and you can fly
20-03-2012,unknown,HAL approached for super jumbo project
21-03-2012,unknown,Nagathihalli returns with Preethiya Hudugi
22-03-2012,unknown,Fashion in the future
23-03-2012,unknown,Promises to keep
26-03-2012,unknown,Home is where the holistic science is
27-03-2012,unknown,A noisy effort to spruce up Commercial Street
28-03-2012,unknown,The best music of the year
29-03-2012,unknown,Redemption night; amid some rock
30-03-2012,unknown,Consul is back from month-long leave
02-04-2012,unknown,Bomb hoax triggers panic in Canara Bank
03-04-2012,unknown,Petition over ministers' assets dismissed
04-04-2012,unknown,He beat polio; but a truck driver's is no life
05-04-2012,unknown,Destroying myths and doubts on sexuality
09-04-2012,unknown,Planning Dept seeks Rs 350 crore more
10-04-2012,unknown,More engg colleges if needed in state: Govt
11-04-2012,unknown,Auto driver's murder: 4 held
12-04-2012,unknown,Meet held on cashew crop forecasting
13-04-2012,unknown,Awareness rally on AIDS today
16-04-2012,unknown,Record power generation at RTPS
17-04-2012,unknown,Move to stop freedom fighters' pension flayed
18-04-2012,unknown,Snags delay digital maps of city
19-04-2012,unknown,Making education a people's movement
20-04-2012,unknown,Murder spoils 2001 party in Dharwad
23-04-2012,unknown,Now a website on a seer
24-04-2012,unknown,Akki-Alur and Ranebennur peaceful
25-04-2012,unknown,Weekly editor resorts to hunger strike
26-04-2012,unknown,Bickering cost Dal(S) seats; admits Gowda
27-04-2012,unknown,BJP to block traffic statewide on Jan 6
30-04-2012,unknown,Dr Patwardhan to be felicitated
01-05-2012,unknown,Lingambudhi will be turned into bird sanctuary
02-05-2012,unknown,Cactus which made it to Guinness is dying
03-05-2012,unknown,VIPs suffer as power supply is stopped to govt guest houses
04-05-2012,entertainment.hindi.bollywood,Raju Chacha
07-05-2012,unknown,Powerless north India gropes in the dark
08-05-2012,unknown,Think again; Laxman tells Sangh Parivar
09-05-2012,unknown,Hurriyat undecided over team to Pakistan
10-05-2012,unknown,Vajpayee wants to put reforms on fast track
11-05-2012,unknown,Stephen Hawking keeps date with Mumbai
14-05-2012,unknown,Anti-Hrithik or anti-hopelessness
15-05-2012,unknown,Govt plans stadium near Panaji
16-05-2012,unknown,BJP doing a volte face on casinos: Cong
17-05-2012,unknown,3 watershed projects on the anvil
18-05-2012,unknown,No report yet on fire in Udyog Bhavan
21-05-2012,unknown,He is the king of 'five star' industry
22-05-2012,unknown,Petrol pump sealed for selling adulterated fuel
23-05-2012,unknown,Milk price up by Rs 1 per litre
24-05-2012,unknown,Congress House is no-smoking zone
25-05-2012,unknown,Rural weightage: Govt reassures Governor
29-05-2012,unknown,Bride gets honeymoon surprise: Chopper ride
30-05-2012,unknown,Is hangover a sign of alcoholicism?
31-05-2012,unknown,Almatti: AP to wait and watch
01-06-2012,unknown,10-year-old girl missing
04-06-2012,unknown,Hear his messages from the heart
05-06-2012,unknown,Dance like no one's watching
06-06-2012,unknown,From reel love to real love
07-06-2012,unknown,Power row: Bribe attempt charge denied
08-06-2012,unknown,Lakshamma's cry for help heard
11-06-2012,unknown,It's shopping time for your newborn
12-06-2012,unknown,Con games on the catwalk
13-06-2012,unknown,They are here to help us
14-06-2012,unknown,These noisy spots are hurting your ears
15-06-2012,unknown,Flat tyres; flat music and a few famous faces
18-06-2012,unknown,Yogananda birth anniversary fete on Dec 5
19-06-2012,unknown,Tumkur gets 243 borewells
20-06-2012,unknown,Over 2000 workers hit by lockout
21-06-2012,unknown,Child project officer held for fraud
22-06-2012,unknown,BCC holds talks on budget
25-06-2012,unknown,Skybus metro trains on agenda
26-06-2012,unknown,A disciple awaits a miracle from his Goddess
27-06-2012,unknown,TOI scribe among Press Academy awardees
28-06-2012,unknown,Talent Search exams on April 29
29-06-2012,unknown,Ban orders extended in Ranebennur
02-07-2012,unknown,Army turns to HAL for Lancer supply
03-07-2012,entertainment.hindi.bollywood,'Devdas': Jinxed?
05-07-2012,unknown,The string that pulled Stephen Hawking to India
06-07-2012,unknown,Vajpayee gives big push to tech education; R&D
09-07-2012,unknown,Norms for private role in banking tightened
10-07-2012,unknown,A Maha Kumbh of media players
11-07-2012,unknown,Net lottery: A winner or a sucker?
12-07-2012,unknown,Us and the PM's Musings
13-07-2012,unknown,Milosevic to be charged with 'abuse of office'
16-07-2012,unknown,Tabu: Bar Bar Dekho
17-07-2012,unknown,Anupam Kher: Sliver Spoon!
18-07-2012,unknown,Aftab Shivdasani: Career Cares!
19-07-2012,unknown,Court reserves judgment on custody of Ilyasi's daughter
20-07-2012,unknown,A museum far from the madding crowds
23-07-2012,unknown,Bangla Oppn leader issues 'fatwa' against judges
24-07-2012,unknown,Hawking set to inspire science glitterati
25-07-2012,unknown,Mission for technology education; more funds for R&D
26-07-2012,unknown,Mental illness can pass from parent to child
27-07-2012,unknown,Cholera outbreak source traced
30-07-2012,unknown,Mathematics permeates human civilisation
31-07-2012,unknown,Bangla Oppn leader issues 'fatwa' against judges
01-08-2012,unknown,Bangladesh govt asks for Hamoodur Rahman report
02-08-2012,unknown,Bangladesh 'scrutinising' citizen's death in US embassy
03-08-2012,unknown,Claire Danes inks to star in 'It's About Love'
06-08-2012,unknown,Hollywood posts record 9th year of box office gains
07-08-2012,unknown,Akashdeep: Ghaath Ka Saath!
08-08-2012,unknown,Great loss to Indian racing
09-08-2012,unknown,The saga of Usha Stud Farm
10-08-2012,unknown,Red Radior wins Victory Zone Cup
13-08-2012,unknown,Race put off
14-08-2012,unknown,Cyril sends Byron Black packing
15-08-2012,unknown,Dent has the fastest serve in Chennai meet
16-08-2012,unknown,Basu gives call to stop infighting
17-08-2012,unknown,Violence mar Mamata's meeting in Midnapore
20-08-2012,unknown,The string that pulled Stephen Hawking to India
21-08-2012,unknown,Norms for private role in banking tightened
22-08-2012,unknown,Net lottery: A winner or a sucker?
23-08-2012,unknown,Us and the PM's Musings
24-08-2012,unknown,Milosevic to be charged with 'abuse of office'
27-08-2012,unknown,Tabu: Bar Bar Dekho
28-08-2012,unknown,Anupam Kher: Sliver Spoon!
29-08-2012,unknown,Court reserves judgment on custody of Ilyasi's daughter
30-08-2012,unknown,A museum far from the madding crowds
31-08-2012,unknown,Bangla Oppn leader issues 'fatwa' against judges
04-09-2012,unknown,Court reserves judgment on custody of Ilyasi's daughter
05-09-2012,unknown,String theory set to become one of hottest pieces of physics
06-09-2012,unknown,Hawking set to inspire science glitterati
07-09-2012,unknown,Mission for technology education; more funds for R&D
10-09-2012,unknown,Mission for technology education; more funds for R&D
11-09-2012,unknown,Mental illness can pass from parent to child
12-09-2012,unknown,Cholera outbreak source traced
13-09-2012,unknown,Mathematics permeates human civilisation
14-09-2012,unknown,The string that pulled Stephen Hawking to India
17-09-2012,unknown,Vajpayee gives big push to tech education; R&D
18-09-2012,unknown,Norms for private role in banking tightened
19-09-2012,unknown,A Maha Kumbh of media players
20-09-2012,unknown,Net lottery: A winner or a sucker?
21-09-2012,unknown,Us and the PM's Musings
24-09-2012,unknown,Milosevic to be charged with 'abuse of office'
25-09-2012,unknown,Tabu: Bar Bar Dekho
26-09-2012,unknown,Anupam Kher: Sliver Spoon!
27-09-2012,unknown,Aftab Shivdasani: Career Cares!
28-09-2012,unknown,Court reserves judgment on custody of Ilyasi's daughter
01-10-2012,unknown,A museum far from the madding crowds
02-10-2012,unknown,Four more Iranians admit to role in serial murders
03-10-2012,unknown,Bangla Oppn leader issues 'fatwa' against judges
04-10-2012,unknown,String theory set to become one of hottest pieces of physics
05-10-2012,unknown,Hawking set to inspire science glitterati
08-10-2012,unknown,Mission for technology education; more funds for R&D
09-10-2012,unknown,Mental illness can pass from parent to child
10-10-2012,unknown,Cholera outbreak source traced
11-10-2012,unknown,Mathematics permeates human civilisation
12-10-2012,unknown,Bangla Oppn leader issues 'fatwa' against judges
15-10-2012,unknown,Bangladesh govt asks for Hamoodur Rahman report
16-10-2012,unknown,Bangladesh 'scrutinising' citizen's death in US embassy
17-10-2012,unknown,Hollywood posts record 9th year of box office gains
18-10-2012,unknown,Great loss to Indian racing
19-10-2012,unknown,The saga of Usha Stud Farm
22-10-2012,unknown,Red Radior wins Victory Zone Cup
23-10-2012,unknown,Race put off
24-10-2012,unknown,Basu gives call to stop infighting
25-10-2012,unknown,Violence mar Mamata's meeting in Midnapore
26-10-2012,unknown,CPT to have new pilot system by Jan 15
31-10-2012,unknown,Film industry concerned about piracy
01-11-2012,unknown,City drainage system being modernised
02-11-2012,unknown,Keeping the Gandhian dream alive
05-11-2012,unknown,An archaeologist par excellence
06-11-2012,unknown,Education body overshoots self-imposed deadline
07-11-2012,unknown,PIL urges to seek flood relief from UN
08-11-2012,unknown,Sen urges country to exploit its tourism potential
09-11-2012,unknown,CMC to issue notice to builder
12-11-2012,unknown,World govt touted as solution to crises
13-11-2012,unknown,ASI team digs up part of Fatehpur Sikri
14-11-2012,unknown,Lara joins elite club
15-11-2012,unknown,Cullinan hits fourth Newlands hundred
16-11-2012,unknown,Cronje case behind low cricket match attendance
19-11-2012,unknown,Indian refusal cost PCB 2.4 cr
20-11-2012,unknown,Das ready to face the short-pitch stuff
21-11-2012,unknown,Haldipur; Lahiri in good stand
23-11-2012,unknown,DU North Zone inter-varsity cricket champions
26-11-2012,unknown,Kolkata gears up for Millennium Cup
27-11-2012,unknown,Right choice is the key; says Iranian coach
28-11-2012,unknown,Rajasthan lose lead and match
29-11-2012,unknown,Hockey hopes rest on flowerin talent
30-11-2012,unknown,Anand may get Padmabhushan
03-12-2012,unknown,Emotion-choked Chennai showers love on Anand
04-12-2012,unknown,Close battle for Mahindra Golfer; 2001
05-12-2012,unknown,Indian Blues off to a good start
06-12-2012,unknown,Ramgarh beat Royal Kashmir in Hanut Cup polo
07-12-2012,unknown,Anand may get Padmabhushan
10-12-2012,unknown,Cullinan hits fourth Newlands hundred
11-12-2012,unknown,Ex-mayor takes up cudgels against Kothrud garbage depot
12-12-2012,unknown,India is no IT superpower
13-12-2012,unknown,A clean sweep
14-12-2012,unknown,The Sphinx can act too
17-12-2012,unknown,Giving audio-video education a cutting edge
18-12-2012,unknown,Govt orders study of river diversion
19-12-2012,unknown,Govt bears burden as VIPs throng Goa
20-12-2012,unknown,Goa told to start quick-growth coconut project
21-12-2012,unknown,Experts discuss horticulture development
24-12-2012,unknown,5 acquitted in trespassing case
26-12-2012,unknown,Development of horticulture stressed
27-12-2012,unknown,New office-bearers for ICSI
28-12-2012,unknown,CM to review security for Premji; Murthy
31-12-2012,unknown,Govt allots UKP project to KPC
02-01-2013,unknown,Star hotels in city get tech-savvy
03-01-2013,unknown,When principals wed
04-01-2013,unknown,Misbehaving conductors face action
07-01-2013,unknown,Pubs are on the watch for violence
08-01-2013,unknown,Celestial show awaits aircraft lovers
09-01-2013,unknown,Kannada organisations oppose felicitating Nedumaran
10-01-2013,unknown,Civic polls: Minister refutes BJP charges
11-01-2013,unknown,Oh; for that black & white magic!
14-01-2013,unknown,No clue about kidnapped boy
15-01-2013,unknown,New year hash: They paid Rs 18;000; went hungry
16-01-2013,unknown,5;000 anganwadis to get buildings
17-01-2013,unknown,Cops shoot at sandalwood smugglers; nab one
18-01-2013,unknown,Tribute-paying ritual for Patel today
22-01-2013,unknown,A life snuffed out needlessly
23-01-2013,unknown,PM arriving on a 2-day visit
24-01-2013,unknown,Make mysterious kidnap drama secret public
25-01-2013,unknown,Pollution makes these residents see red
28-01-2013,unknown,Behind the walls; it's celebration time
29-01-2013,unknown,Corporate cricket has lot of scope
30-01-2013,unknown,An art gallery for the underprivileged
31-01-2013,unknown,Annual Infant Jesus feast from Jan 14
01-02-2013,unknown,Ex-Karnataka HC judge visits Bahrain
04-02-2013,india,Dudhwa tiger died of starvation; not poisoning
05-02-2013,city.bengaluru,Three in race for chief secy's post
06-02-2013,city.patna,Druggists' stir leads to shortage of medicines
07-02-2013,business.india-business,Car dealers caught in Bihar sales tax ruling
08-02-2013,entertainment.english.hollywood,Space Cowboys
11-02-2013,city.bengaluru,He's not so inscrutable
12-02-2013,city.delhi,DPCC stages Nyay rally
13-02-2013,entertainment.english.hollywood,Unbreakable
14-02-2013,unknown,Light combat craft takes India into club class
15-02-2013,unknown,Hawkings' day out
19-02-2013,unknown,Light combat craft takes India into club class
20-02-2013,unknown,Easy drugs at raves keep Goa hot on tourist circuit
21-02-2013,unknown,CM defends grant to Chaturang
22-02-2013,unknown,Faleiro vows to fight common cadre proposal
25-02-2013,unknown,Sawant questions casino licences
26-02-2013,unknown,MPT posts good show in 2000
27-02-2013,unknown,Ex-GPCC chief against separate cadre
28-02-2013,unknown,Meeting to review anti-defection law
01-03-2013,unknown,Telecom team win play contest
04-03-2013,unknown,Guala Closures bags ISO 9002 certificate
05-03-2013,unknown,Bush names Lindsey top economic aide
06-03-2013,unknown,Bush names Lindsey top economic aide
07-03-2013,unknown,Indian American boy confesses to parents' murder
08-03-2013,unknown,Anti-immigration think-tank berates Clinton regime
11-03-2013,unknown,Sikh teacher guilty of assaulting student
12-03-2013,unknown,Australia; New Zealand urged to accept Indo-Fijian refugees
13-03-2013,unknown,If Rabuka can go free; why not us: Speight partner
14-03-2013,unknown,Tailor Sam's famous clientele
15-03-2013,unknown,Malaysian medics testify about demonstrators' injuries
18-03-2013,unknown,Philippine soldiers arrest bombing suspects
19-03-2013,unknown,Chinese stranded in Dhaka repatriated
20-03-2013,unknown,It's long haul yet for the LCA
21-03-2013,unknown,Captain Courageous says dream has come true
22-03-2013,unknown,LCA to be good enough for next 45 yrs
25-03-2013,unknown,LCA to be top in avionics; strike capability
26-03-2013,unknown,Light combat craft takes India into club class
27-03-2013,unknown,Hawkings' day out
28-03-2013,unknown,Easy drugs at raves keep Goa hot on tourist circuit
01-04-2013,unknown,CM defends grant to Chaturang
02-04-2013,unknown,Faleiro vows to fight common cadre proposal
03-04-2013,unknown,Sawant questions casino licences
04-04-2013,unknown,MPT posts good show in 2000
05-04-2013,unknown,Ex-GPCC chief against separate cadre
08-04-2013,unknown,Meeting to review anti-defection law
09-04-2013,unknown,Telecom team win play contest
10-04-2013,unknown,Guala Closures bags ISO 9002 certificate
11-04-2013,unknown,Bush names Lindsey top economic aide
12-04-2013,unknown,Bush names Lindsey top economic aide
15-04-2013,unknown,Indian American boy confesses to parents' murder
16-04-2013,unknown,Indian American boy confesses to parents' murder
17-04-2013,unknown,Anti-immigration think-tank berates Clinton regime
18-04-2013,unknown,Sikh teacher guilty of assaulting student
19-04-2013,unknown,Australia; New Zealand urged to accept Indo-Fijian refugees
22-04-2013,unknown,If Rabuka can go free; why not us: Speight partner
23-04-2013,unknown,Tailor Sam's famous clientele
24-04-2013,unknown,Malaysian medics testify about demonstrators' injuries
25-04-2013,unknown,Philippine soldiers arrest bombing suspects
26-04-2013,unknown,Chinese stranded in Dhaka repatriated
29-04-2013,unknown,Light combat craft takes India into club class
30-04-2013,unknown,It's long haul yet for the LCA
01-05-2013,unknown,Captain Courageous says dream has come true
02-05-2013,unknown,LCA to be good enough for next 45 yrs
03-05-2013,unknown,LCA to be top in avionics; strike capability
06-05-2013,unknown,CM asks KPTC to keep power tariff hike in abeyance
07-05-2013,unknown,Gowda and Hegde share dais; but fail to talk
08-05-2013,unknown,This cactus is all set to break records
09-05-2013,unknown,Function can't be stopped: Kharge
10-05-2013,unknown,Think twice before you make a wish
13-05-2013,unknown,LCA: Best weapon system for close combat
14-05-2013,unknown,LCA test flight puts India in exclusive club
15-05-2013,unknown,A dream-come-true for LCA pilot
16-05-2013,unknown,Avionics provides multi-role capability to LCA
17-05-2013,unknown,Hoax bomb call sends family into a tizzy
20-05-2013,unknown,Govt order on dismantling Hampi bridge stayed
21-05-2013,unknown,Principals of PU colleges to meet on Jan. 7
22-05-2013,unknown,CM meets Sonia at airport
23-05-2013,unknown,Tributes paid to Patel
24-05-2013,unknown,I am a great fan of Sridevi: Prema
28-05-2013,unknown,This chef knows his yin from yang
29-05-2013,unknown,Wait; wait... for the bus that never comes
30-05-2013,unknown,Taal se taal mila
31-05-2013,unknown,Light combat craft takes India into club class
03-06-2013,unknown,Hawkings' day out
04-06-2013,unknown,Easy drugs at raves keep Goa hot on tourist circuit
05-06-2013,unknown,CM defends grant to Chaturang
06-06-2013,unknown,Sawant questions casino licences
07-06-2013,unknown,MPT posts good show in 2000
10-06-2013,unknown,Ex-GPCC chief against separate cadre
11-06-2013,unknown,Meeting to review anti-defection law
12-06-2013,unknown,Guala Closures bags ISO 9002 certificate
13-06-2013,unknown,Bush names Lindsey top economic aide
14-06-2013,unknown,Bush names Lindsey top economic aide
17-06-2013,unknown,Indian American boy confesses to parents' murder
18-06-2013,unknown,Anti-immigration think-tank berates Clinton regime
19-06-2013,unknown,Sikh teacher guilty of assaulting student
20-06-2013,unknown,Australia; New Zealand urged to accept Indo-Fijian refugees
21-06-2013,unknown,If Rabuka can go free; why not us: Speight partner
24-06-2013,unknown,Tailor Sam's famous clientele
25-06-2013,unknown,Malaysian medics testify about demonstrators' injuries
26-06-2013,unknown,Philippine soldiers arrest bombing suspects
27-06-2013,unknown,Chinese stranded in Dhaka repatriated
28-06-2013,unknown,Light combat craft takes India into club class
01-07-2013,unknown,It's long haul yet for the LCA
02-07-2013,unknown,Captain Courageous says dream has come true
03-07-2013,unknown,LCA to be good enough for next 45 yrs
05-07-2013,unknown,LCA to be top in avionics; strike capability
08-07-2013,unknown,CM asks KPTC to keep power tariff hike in abeyance
09-07-2013,unknown,Gowda and Hegde share dais; but fail to talk
10-07-2013,unknown,This cactus is all set to break records
11-07-2013,unknown,Function can't be stopped: Kharge
12-07-2013,unknown,Think twice before you make a wish
15-07-2013,unknown,LCA: Best weapon system for close combat
16-07-2013,unknown,LCA will be aircraft for next 45 years
17-07-2013,unknown,LCA test flight puts India in exclusive club
18-07-2013,unknown,A dream-come-true for LCA pilot
19-07-2013,unknown,Avionics provides multi-role capability to LCA
22-07-2013,unknown,Hoax bomb call sends family into a tizzy
23-07-2013,unknown,Govt order on dismantling Hampi bridge stayed
24-07-2013,unknown,Principals of PU colleges to meet on Jan. 7
25-07-2013,unknown,CM meets Sonia at airport
26-07-2013,unknown,Tributes paid to Patel
29-07-2013,unknown,I am a great fan of Sridevi: Prema
30-07-2013,unknown,This chef knows his yin from yang
31-07-2013,unknown,Wait; wait... for the bus that never comes
01-08-2013,unknown,Taal se taal mila
02-08-2013,unknown,Mahalakshmi Layout: Crumbling past; rapid growth
05-08-2013,unknown,'We're waiting for people with money'
06-08-2013,unknown,An actress and many other things besides
07-08-2013,unknown,Mobile isn't a phone but a fun machine now
08-08-2013,unknown,Time to bow out for 14 top bureaucrats
09-08-2013,unknown,Silk is sexy this year
12-08-2013,unknown,Seeds firm condemns hooliganism
13-08-2013,edit-page,Nepal won't allow anti-India activities: Envoy
14-08-2013,india,MP best in forest development: Centre
15-08-2013,unknown,Light combat craft takes India into club class
16-08-2013,unknown,Hawkings' day out
19-08-2013,unknown,Ex-GPCC chief against separate cadre
20-08-2013,unknown,Meeting to review anti-defection law
21-08-2013,unknown,Telecom team win play contest
22-08-2013,unknown,Guala Closures bags ISO 9002 certificate
23-08-2013,unknown,Bush names Lindsey top economic aide
26-08-2013,unknown,Bush names Lindsey top economic aide
27-08-2013,unknown,Indian American boy confesses to parents' murder
28-08-2013,unknown,Anti-immigration think-tank berates Clinton regime
29-08-2013,unknown,Sikh teacher guilty of assaulting student
30-08-2013,unknown,Australia; New Zealand urged to accept Indo-Fijian refugees
03-09-2013,unknown,Muslim body rules out talks on Ayodhya
04-09-2013,unknown,Bajrang Dal blows hot; cold
05-09-2013,unknown,Vajpayee rejects Nitish's resignation
06-09-2013,unknown,PM taps diaspora to realise Indian ambition
09-09-2013,unknown,India cagey about food imports
10-09-2013,unknown,US leggy chicks to come in hordes
11-09-2013,unknown,Microsoft; Intel line up top-end products for electronics show
12-09-2013,unknown,Khosla among Upside's 25 people to watch in 2001
13-09-2013,unknown,Spending on Net projects may be hit
16-09-2013,unknown,British doctor may be worst mass murderer in modern history
17-09-2013,unknown,British judge reveals threats from racists
18-09-2013,unknown,Clinton urges US Congress to ratify CTBT
19-09-2013,unknown,Blind climber to scale Mt. Everest
20-09-2013,unknown,Does American TV have a realism overdose?
23-09-2013,unknown,Banking community must chalk out new system: Jalan
24-09-2013,unknown,Delhi to host India-EU working group meeting on IT
25-09-2013,unknown,PNB raises rates
26-09-2013,unknown,Are green activists the new imperialists
27-09-2013,unknown,Muslim body rules out talks on Ayodhya
30-09-2013,unknown,Bajrang Dal blows hot; cold
01-10-2013,unknown,Vajpayee rejects Nitish's resignation
02-10-2013,unknown,PM taps diaspora to realise Indian ambition
03-10-2013,unknown,India cagey about food imports
