07-07-2015,unknown,Mamata Express
08-07-2015,unknown,Stoking Sentiment
09-07-2015,unknown,St Francis; Patron Saint of Ecology
10-07-2015,unknown,The Learning Curve
13-07-2015,unknown,Songs of Freedom
14-07-2015,unknown,Another Duleep double for Mongia
15-07-2015,unknown,France; India to hold strategic talks
16-07-2015,unknown,Acceptances for Delhi races
17-07-2015,unknown,Canadian airline to sponsor Mumbai Marathon of Hope
20-07-2015,unknown,US Congressmen urged to join India caucus
21-07-2015,unknown,Pak brothers arrested in US sting operation
22-07-2015,unknown,Indian; Pakistani delegates clash at Disarmament Conference
23-07-2015,unknown,Indians; Pakistanis con S African women into marriages
24-07-2015,unknown,Millennium Cup promoters are a wiser lot now
27-07-2015,unknown,Footballers do Bangalore proud
28-07-2015,unknown,Pak welcomes train accord extension with India
29-07-2015,unknown,Insurance firm to compensate accident victim
30-07-2015,unknown,Rallyists; tremor-hit keep cops busy
31-07-2015,unknown,Police put feet up
03-08-2015,unknown,Of crimes in the times of dotcons
04-08-2015,unknown,An excise exercise in the line of duty
05-08-2015,unknown,If you are caught; stick to the sturdy
06-08-2015,unknown,Govt dispensaries to be open at night
07-08-2015,unknown,Panel flays DDA's Manhattan mania on Yamuna
10-08-2015,unknown,Rural sector to get top priority: L-G
11-08-2015,unknown,History datelist to help in census
12-08-2015,unknown,HC asks Centre for ATR on naval missile battery case
13-08-2015,unknown,Builders don't spend on safety: Experts
14-08-2015,unknown,This is not the end; predict astrologers
17-08-2015,unknown,Is the clock ticking for Delhi?
18-08-2015,unknown,Party potboiler: Man; can he cook!
19-08-2015,unknown,Tremors fail to jolt Govts to action: PIL
20-08-2015,unknown,Relative kills 9-year-old
21-08-2015,unknown,Bovine Biotech: Milking microbes dry
24-08-2015,unknown,The unpredictable calamity
25-08-2015,unknown,Centre promises all aid
26-08-2015,unknown,Death; distress; destruction...and it's not over yet
27-08-2015,unknown,The town that was once Bhuj
28-08-2015,unknown,Massive rescue to save Gujarat
31-08-2015,unknown,300 children trapped
01-09-2015,unknown,Jnanpith awarded to Nirmal Verma; Gurdial Singh
02-09-2015,unknown,Lata overwhelmed by Bharat Ratna
03-09-2015,unknown,Guess Neha's 'Ehsaas'
04-09-2015,unknown,Mahesh Manjrekar: Primary colours
08-09-2015,unknown,Damle acts non-stop for 15 hours
09-09-2015,unknown,DoCoMo eyeing US market
10-09-2015,unknown,NexTone to partner Cognitronics
11-09-2015,unknown,Quake affects telecom; power
14-09-2015,unknown,Autolite India exonerated by French court
15-09-2015,unknown,Titan Q3 sales up 8.3 per cent
16-09-2015,unknown,India woos US oil industry
17-09-2015,unknown,JCPK is about what to do with money
18-09-2015,unknown,Nature is the cruellest killer
21-09-2015,unknown,Quakeffect: Investors need not worry
22-09-2015,unknown,It's online: Travel is on a roll
23-09-2015,unknown,Over 150 exporters to participate in garment fair
24-09-2015,unknown,NexTone to partner Cognitronics
25-09-2015,unknown,DoCoMo eyeing US market
28-09-2015,unknown,The Word Factory
29-09-2015,unknown,She could have danced all night
30-09-2015,unknown,We are unable to face reality
01-10-2015,unknown,The Kiteman cometh
02-10-2015,unknown,Hyphenating cinema
05-10-2015,unknown,At home with the Minister
06-10-2015,unknown,He was the sexiest man in India
07-10-2015,unknown,Of fortune & Feng Shui
08-10-2015,unknown,Can an RSS man become an ISI agent
09-10-2015,unknown,She levitates up the social ladder
12-10-2015,unknown,Is the Republic Day parade out of step with the times?
13-10-2015,unknown,Our Secular Brew
14-10-2015,unknown,Unholy Smokes
15-10-2015,unknown,Don't rob Prashant's future
16-10-2015,unknown,Shilanayas was allowed to avoid a bloodbath
19-10-2015,unknown,Constable arrested for shooting at AIIMS employee
20-10-2015,unknown,Another example of police high-handedness
21-10-2015,unknown,How sound is the ground beneath Delhi's feet?
22-10-2015,unknown,Can Delhi deal with disasters?
23-10-2015,unknown,Hospitals are far from equipped
26-10-2015,unknown,Ill-prepared for disaster
27-10-2015,unknown,28-yr-old found dead in bathroom
28-10-2015,unknown,Cops gearing up to face new threats
29-10-2015,unknown,Don't Rob Prashant's Future
30-10-2015,unknown,More tremors forecast for the next 48 hours
02-11-2015,unknown,The town that lay forgotten for 36 hours
03-11-2015,unknown,Gujarat finds hope in army of good Samaritans
04-11-2015,unknown,Too much; too late
05-11-2015,unknown,Govt opens purse-strings; seeks $1.5 bn loan
06-11-2015,unknown,Hrithik Roshan: Organised chaos
09-11-2015,unknown,Twinkle Khanna: Dramabaazi! This time on stage!
10-11-2015,unknown,Mahesh; Satnam: Best buddies
11-11-2015,unknown,Wide acclaim for Indian films in US festival
12-11-2015,unknown,'Kuch Kuch Hota Hai' craze in SE Asia
13-11-2015,unknown,Hrithik Roshan: Organised chaos
16-11-2015,unknown,Hey Ram; Karunam; Hum Dil... big draw in US fest
17-11-2015,unknown,Gun Culture
18-11-2015,unknown,BJP whisks Cong MLA to further its plans
19-11-2015,unknown,Assistant bank manager held in arms scandal
20-11-2015,unknown,59-year-old widow murdered
23-11-2015,unknown,Fiji Hindus protest religious curbs
24-11-2015,unknown,Australia pledges $1 m for quake victims
25-11-2015,unknown,Taiwan activists plan sit-in over nuclear project
27-11-2015,unknown,Angolan president arrives in Japan
30-11-2015,unknown,After the Shock
01-12-2015,unknown,Honours Even
02-12-2015,unknown,Step by Step
03-12-2015,unknown,Processing Peace
04-12-2015,unknown,Basant : Festival of Renewal and Hope
07-12-2015,unknown,Night Bus to Ajmer
08-12-2015,unknown,Maha Saraswati
09-12-2015,unknown,The Enchanted Forester
10-12-2015,unknown,Straight Answers
11-12-2015,unknown,The question that started the Hinduja affair
14-12-2015,unknown,Tigers refuse to sign Norwegian peace deal
15-12-2015,unknown,Kuwait Red Cross donates $250;000 for quake victims
16-12-2015,unknown,UAE NRIs mobilise relief for quake victims
17-12-2015,unknown,Tigers refuse to sign Norwegian peace deal
18-12-2015,unknown,Fiji Hindus protest religious curbs
21-12-2015,unknown,Students back home safe after trauma in Gujarat
22-12-2015,unknown,No aftershock here: Bangalorean safe
23-12-2015,unknown,State sends para-medical staff to quake-hit areas
24-12-2015,unknown,Get your brooms out ... Harry Potter's coming to town
28-12-2015,unknown,One in spirit; one in mind
29-12-2015,unknown,Man falls 30 feet down __ and survives
30-12-2015,unknown,Spunky 60-year-old woman prevents burglary
31-12-2015,unknown,Lawyers want more women judges on High Court bench
04-01-2016,unknown,Chuck your vote into the corner garbage bin
05-01-2016,unknown,Doesn't get batter than this
06-01-2016,unknown,Hams rush to Gujarat to help connect people
07-01-2016,unknown,Krishna for regulatory regime in IT sector
08-01-2016,unknown,Let them soar; don't clip their freedom
11-01-2016,unknown,Karnataka plans one-stop export shop
12-01-2016,unknown,Hrithik: Miss Indias' delight!
13-01-2016,unknown,Manoj Bajpai: Friends & foes!
14-01-2016,unknown,Apoorva Agnihotri: On a roll!
15-01-2016,unknown,Kalpana Lajmi: We 'daman'd an explanation!
19-01-2016,unknown,Hrithik: Miss Indias' delight!
20-01-2016,unknown,Manoj Bajpai: Friends & foes!
21-01-2016,unknown,Kalpana Lajmi: We 'daman'd an explanation!
22-01-2016,unknown,Apoorva Agnihotri: On a roll!
25-01-2016,unknown,Quake spares Bangalore; rumours shake city
26-01-2016,unknown,Fear rocks hospital beds in Bangalore
27-01-2016,unknown,Karnataka relatively safe; assert experts
28-01-2016,unknown,Rumours give kids a holiday
29-01-2016,unknown,Swalpa Kannada speak maadtheera?
01-02-2016,unknown,I thought they were doing black magic; recalls survivor
02-02-2016,unknown,Civic agencies say they're ready to take on a quake
03-02-2016,unknown,City buildings quake-proof: architects
04-02-2016,unknown,Animals knew it all
05-02-2016,unknown,Krishna's Kannada-stance may mess up CET
08-02-2016,unknown,Tell them no stories; it's non-fiction they want
09-02-2016,unknown,Industries; railways to get recycled water
10-02-2016,unknown,New software helps police keep track of accidents
11-02-2016,unknown,Phase II of Swachha Bangalore project is on
12-02-2016,unknown,Survivor still in shock
16-02-2016,unknown,Kannada film crew safe in Rajasthan
17-02-2016,unknown,State to have disaster management group soon
18-02-2016,unknown,Dacoits loot Dharwad guest house
19-02-2016,unknown,Joshi wants permanent disaster system
22-02-2016,unknown,HC issues notice to BCC on labourers' safety
23-02-2016,unknown,Preventing AIDS is a man's job; too
24-02-2016,unknown,Gang robs advocate
25-02-2016,unknown,Poets to raise funds for quake victims
26-02-2016,unknown,Parents against Kendriya Vidyalaya's new schedule
29-02-2016,unknown,Joshi calls for decentralised communities
01-03-2016,unknown,Shimoga must promote agriculture: Ramesh
02-03-2016,unknown,MLA donates salary for quake victims
03-03-2016,unknown,Water testing campaign from Feb 1
04-03-2016,unknown,Ten held for stealing coal
07-03-2016,unknown,Christians protest over inaction
08-03-2016,unknown,Railway zone registers 10.8 per cent rise in freight transport
09-03-2016,unknown,BSNL sets 6 lakh connections as target for 2000-01
10-03-2016,unknown,Money meant for road repairs goes down the drain
11-03-2016,unknown,SUCI urges hospital withdraw extra fees
14-03-2016,unknown,After Rajangana; Pejawar seer has other plans
15-03-2016,unknown,Relief operations take back seat in Bhuj
16-03-2016,unknown,Fernandes pegs quake toll at 100;000
17-03-2016,unknown,Killer quake grounds Kandla port
18-03-2016,unknown,Centre gets Rs 13;500 cr quake bill from Gujarat
21-03-2016,unknown,India Inc chips in with money; men
22-03-2016,unknown,After Shock
23-03-2016,unknown,Building from Scratch
24-03-2016,unknown,Existential Choice
28-03-2016,unknown,Time after Time
29-03-2016,unknown,Taming the Tremors
30-03-2016,unknown,Jiddu Krishnamurti's Holistic Approach
31-03-2016,unknown,Rumble in the Jungle
01-04-2016,unknown,A Helping Hand
04-04-2016,unknown,Boxed in by the Budget
05-04-2016,unknown,Straight Answers
06-04-2016,unknown,India to launch two more IRS
07-04-2016,unknown,Officials booked for man's death
08-04-2016,unknown,Remote sensing cannot predict quakes
11-04-2016,unknown,Team to Gujarat will leave today
12-04-2016,unknown,Beware against bogus quake relief agencies
13-04-2016,unknown,Fatorda residents demand closure of bar
14-04-2016,unknown,Akshay Kumar: Work is worship!
15-04-2016,unknown,Pune prone to transmitive quake waves; says expert
18-04-2016,unknown,Engineer's flay PMC for not ensuring safe constructions
19-04-2016,unknown,Kathak in a kimono
20-04-2016,unknown,Developing the consciousness
21-04-2016,unknown,City astrologer had predicted quake
22-04-2016,unknown,Life in the time of quake
25-04-2016,unknown,Stranger saves a family from death
26-04-2016,unknown,Why cops are scared to catch big fish
27-04-2016,unknown,Sandhya Chib's a model mom now
28-04-2016,unknown,City docs; organisations rush aid to Gujarat
29-04-2016,unknown,Vaastu expert blames it on Pokhran tests
02-05-2016,unknown,Senior officers to coordinate quake relief work
03-05-2016,unknown,LCA test-flown again
04-05-2016,unknown,Air Race to have 20 participants
05-05-2016,unknown,Once cheated; public shy away from donations
06-05-2016,unknown,From childhood to maturity sans adolescence
09-05-2016,unknown,Pacemaker Bank at Manipal Heart Foundation
10-05-2016,unknown,Rumours jammed STD lines in Bangalore
11-05-2016,unknown,Army cordons off Anjar; says it's a mass grave
12-05-2016,unknown,After the quake; the confusion...over toll; losses
13-05-2016,unknown,Quake remarks cost Karnataka minister his job
16-05-2016,unknown,Budget has cushion to absorb quake impact
17-05-2016,unknown,Diya Mirza: Om jai Bollywood!
18-05-2016,unknown,Tabu: Boney; Boney; yes papa!
19-05-2016,unknown,Mithun Chakravarty: Helping the son rise!
20-05-2016,unknown,Shah Rukh: Risky tricks of the trade!
23-05-2016,unknown,Diya Mirza: Om jai Bollywood!
24-05-2016,unknown,Tabu: Boney; Boney; yes papa!
25-05-2016,unknown,Mithun Chakravarty: Helping the son rise!
26-05-2016,unknown,Shah Rukh: Risky tricks of the trade!
27-05-2016,unknown,Pune opens its heart; purse-strings to Gujarat
31-05-2016,unknown,Flying colours
01-06-2016,unknown,Night special
02-06-2016,unknown,Straight Answers
03-06-2016,unknown,Time to get wet'n'wild
06-06-2016,unknown,Will the Chinese kill us?
07-06-2016,unknown,The sound of Alabina
08-06-2016,unknown,Rane has no plans to try for CM gaddi
09-06-2016,unknown,Panchayats told to hold special gramsabhas
10-06-2016,unknown,Not many takers for catering course
13-06-2016,unknown,Hema's ballet on Feb. 3 for quake relief
14-06-2016,unknown,Quake: MLAs urged to give a day's salary
15-06-2016,unknown,IDC created jobs for 1;000 people
16-06-2016,unknown,Bonding for a Cause
17-06-2016,unknown,Dealing with Disaster
20-06-2016,unknown,Army cordons off Anjar; says it's a mass grave
21-06-2016,unknown,After the quake; the confusion...over toll; losses
22-06-2016,unknown,Quake remarks cost Karnataka minister his job
23-06-2016,unknown,It's been a hard day's night for Ahmedabadis
24-06-2016,unknown,Diya Mirza: Om jai Bollywood!
27-06-2016,unknown,Tabu: Boney; Boney; yes papa!
28-06-2016,unknown,Mithun Chakravarty: Helping the son rise!
29-06-2016,unknown,Shah Rukh: Risky tricks of the trade!
30-06-2016,unknown,Pune opens its heart; purse-strings to Gujarat
01-07-2016,unknown,Flying colours
05-07-2016,unknown,Night special
06-07-2016,unknown,Straight Answers
07-07-2016,unknown,Time to get wet'n'wild
08-07-2016,unknown,Will the Chinese kill us?
11-07-2016,unknown,The sound of Alabina
12-07-2016,unknown,Rane has no plans to try for CM gaddi
13-07-2016,unknown,Panchayats told to hold special gramsabhas
14-07-2016,unknown,Not many takers for catering course
15-07-2016,unknown,Hema's ballet on Feb. 3 for quake relief
18-07-2016,unknown,Quake: MLAs urged to give a day's salary
19-07-2016,unknown,IDC created jobs for 1;000 people
20-07-2016,unknown,Bonding for a Cause
21-07-2016,unknown,Dealing with Disaster
22-07-2016,unknown,Speak Easy
25-07-2016,unknown,Other Side of Truth
26-07-2016,unknown,Faith; the Factor That Heals; Sustains
27-07-2016,unknown,Tales of the Road
28-07-2016,unknown,Covetousness
29-07-2016,unknown,The Bhuj Quake: FAQs
01-08-2016,unknown,Straight Answers
02-08-2016,unknown,The Enemy Within
03-08-2016,unknown,Islam Ganj kidnappings: Accused nabbed
04-08-2016,unknown,Court allows the sale of hijackedAirbus
05-08-2016,unknown,Food and supplies dept to donate day's salary
08-08-2016,unknown,Another hoax call paralyses courts for 3 hours
09-08-2016,unknown,Haryana to adopt quake ravaged village
10-08-2016,unknown,Law students to spread legal awareness in remote areas
11-08-2016,unknown,Organic farming need of the day
12-08-2016,unknown,Methods to conserve petrol discussed
15-08-2016,unknown,PU magazine looks at Chandigarh's electoral space
16-08-2016,unknown,Gujarat govt yet to get its act together
17-08-2016,unknown,Pak relief team goes on sari trail
18-08-2016,unknown,Cabinet clears VSNL; CMC selloff
19-08-2016,unknown,Court denies Hindujas permission to leave India
22-08-2016,unknown,Annu Kapoor: Naach gaana!
23-08-2016,unknown,Sikander: The son also rises!
24-08-2016,unknown,Raj Babbar: Condolences!
25-08-2016,unknown,Aditya Pancholi: Into political games!
26-08-2016,unknown,Annu Kapoor: Naach gaana!
29-08-2016,unknown,Sikander: The son also rises!
30-08-2016,unknown,Blair admits Hindujas' attempt to involve him
31-08-2016,unknown,Goans reach out to Gujarat quake victims
01-09-2016,unknown,Carnival should be put off; says D'Souza
02-09-2016,unknown,Konkani drama festival begins on Friday
06-09-2016,unknown,One year after death; baby's body to be buried
07-09-2016,unknown,Govt to boost cultural tourism: CM
08-09-2016,unknown,College fest on Feb 8
09-09-2016,unknown,Solheim visit brightens prospect of Lanka-LTTE talks
12-09-2016,unknown,Jaswant's Cairo visit seeks to revive old ties
13-09-2016,unknown,India; Syria to boost economic; IT cooperation
14-09-2016,unknown,Buddhadeb promises peace in Midnapore
15-09-2016,unknown,Haldia port built over seismic zone: Report
16-09-2016,unknown,Tripartite talks on Darjeeling Gorkha Hill Council
19-09-2016,unknown,Basu; Surjeet ask Chakraborty not to leave CPM
20-09-2016,unknown,Rs 1.6 crore worth of book trade lost due to piracy
21-09-2016,unknown,Book Fair note book
22-09-2016,unknown,About 2;500 medical students yet to receive admit cards
23-09-2016,unknown,First the quake; then the flood
26-09-2016,unknown,Vajpayee; Musharraf break ice; talk Gujarat
27-09-2016,unknown,There will be more taxes; says Vajpayee
28-09-2016,unknown,Govt may clear Sharjah cricket tour on Monday
29-09-2016,unknown,Numbed by tragedy; Bhuj picks up the pieces
30-09-2016,unknown,Subhash Ghai: Snapshots from the past!
03-10-2016,unknown,Govinda: A duplicate matter!
04-10-2016,unknown,Sridevi: Jhanvi ka 'kya kehna'!
05-10-2016,unknown,M F Hussain: Point brushing!
06-10-2016,unknown,Subhash Ghai: Snapshots from the past!
07-10-2016,unknown,Sridevi: Jhanvi ka 'kya kehna'!
10-10-2016,unknown,Govinda: A duplicate matter!
11-10-2016,unknown,Britain's Vaz made exceptional use of office
12-10-2016,unknown,France putting appropriate pressure on Pak: India
13-10-2016,unknown,Greek premier to arrive in India for 5-day visit
14-10-2016,unknown,CM urges Centre to open up tourism sector
17-10-2016,unknown,Govt plans to start more schools for SCs; STs
18-10-2016,unknown,Cong leader files for 'liberty' to pursue cases against CM
19-10-2016,unknown,Train from Gujarat comes packed with hope
20-10-2016,unknown,BJP urges people to donate for quake victims
21-10-2016,unknown,Bush's 'faith-based' initiative draws fire
24-10-2016,unknown,US must accept India's nuclear status: Experts
25-10-2016,unknown,Canada to give another $2 mn for quake relief
26-10-2016,unknown,Bush's abortion fund ban will not impact on India: USAID
27-10-2016,unknown,Ashcroft confirmed as US attorney general
28-10-2016,unknown,Kennedys invited to movie in the White House
31-10-2016,unknown,Jaswant Singh reiterates support for Palestinian homeland
01-11-2016,unknown,Anybody monitoring Delhi's buildings?
02-11-2016,unknown,First the quake; then the flood
03-11-2016,unknown,Vajpayee; Musharraf break ice; talk Gujarat
04-11-2016,unknown,There will be more taxes; says Vajpayee
07-11-2016,unknown,Govt may clear Sharjah cricket tour on Monday
08-11-2016,unknown,Numbed by tragedy; Bhuj picks up the pieces
09-11-2016,unknown,Subhash Ghai: Snapshots from the past!
10-11-2016,unknown,Govinda: A duplicate matter!
11-11-2016,unknown,Sridevi: Jhanvi ka 'kya kehna'!
14-11-2016,unknown,M F Hussain: Point brushing!
15-11-2016,unknown,Subhash Ghai: Snapshots from the past!
16-11-2016,unknown,Sridevi: Jhanvi ka 'kya kehna'!
17-11-2016,unknown,Govinda: A duplicate matter!
18-11-2016,unknown,Britain's Vaz made exceptional use of office
21-11-2016,unknown,France putting appropriate pressure on Pak: India
22-11-2016,unknown,Greek premier to arrive in India for 5-day visit
23-11-2016,unknown,CM urges Centre to open up tourism sector
25-11-2016,unknown,Govt plans to start more schools for SCs; STs
28-11-2016,unknown,Cong leader files for 'liberty' to pursue cases against CM
29-11-2016,unknown,Train from Gujarat comes packed with hope
30-11-2016,unknown,BJP urges people to donate for quake victims
01-12-2016,unknown,Bush's 'faith-based' initiative draws fire
02-12-2016,unknown,US must accept India's nuclear status: Experts
05-12-2016,unknown,Canada to give another $2 mn for quake relief
06-12-2016,unknown,Bush's abortion fund ban will not impact on India: USAID
07-12-2016,unknown,Ashcroft confirmed as US attorney general
08-12-2016,unknown,Kennedys invited to movie in the White House
09-12-2016,unknown,Jaswant Singh reiterates support for Palestinian homeland
12-12-2016,unknown,Anybody monitoring Delhi's buildings?
13-12-2016,unknown,Bhuj-type quake could spare only Supreme Court
14-12-2016,unknown,The Dalai Lama: A Man With A Mission
15-12-2016,unknown,Old man robbed twice by same goons; same day
16-12-2016,unknown,New flyovers can withstand quakes upto 8.5 on the Richter
19-12-2016,unknown,Govt to set up national disaster management panel
20-12-2016,unknown,We can build N-bombs; why not safe houses?
21-12-2016,unknown,Quake effect: Ties with Pak 'thawing'; PM's Japan trip off
22-12-2016,unknown,Unprepared govt undermines relief mobilisation
23-12-2016,unknown,The final verdict: It touched 8.1 on Richter
27-12-2016,unknown,Would the Taj; Qutab withstand a quake?
28-12-2016,unknown,Fab Five: Britain's newest pop sensation
29-12-2016,unknown,Aftab Shivdasani: Bollywood's bachcha on a roll!
30-12-2016,unknown,Govinda elated after street gets folks' names
03-01-2017,unknown,Kareena Kapoor sticks out acerbic tongue!
04-01-2017,unknown,Neetu Singh finds 'housewifery' boring!
05-01-2017,unknown,Images speak for Indo-Russian friendship
06-01-2017,unknown,Delhi hosts festival of short films
09-01-2017,unknown,UTI to launch Infotech company
10-01-2017,unknown,Has the President transgressed constitutional propriety by attacking the PM?
11-01-2017,unknown,Ode to an Asian Vaz
12-01-2017,unknown,The Ground beneath their feet
13-01-2017,unknown,Life and death in Kutch Mandvi
17-01-2017,unknown,Earthquakes; Taliban & the Parsis
18-01-2017,unknown,Everyone was working for a common humanitarian cause
19-01-2017,unknown,Dams as environment saviours
20-01-2017,unknown,The Ground beneath their feet
23-01-2017,unknown,Caught in a cleft stick
24-01-2017,unknown,Life and death in Kutch Mandvi
25-01-2017,unknown,Time to go for equity-linked savings
26-01-2017,unknown,Lessons from Latur and Uttarkashi
27-01-2017,unknown,Tenants living in extensions to the main building are at the greatest risk
30-01-2017,unknown,Penny pinching cost them their lives
31-01-2017,unknown,Science in our daily lives is a political orphan
01-02-2017,unknown,Chappar Phad Ke
02-02-2017,unknown,We never learn lessons
03-02-2017,unknown,What is meant by the term Track-II diplomacy?
06-02-2017,unknown,Ghamanda; Ravina win
07-02-2017,unknown,Official toll put at 16;435; Kutch's share 14;909
08-02-2017,unknown,Relief gets bogged down in politics
09-02-2017,unknown,ACF calls off Sharjah tri-series
10-02-2017,unknown,Just a phone call set the ball rolling
13-02-2017,unknown,The well-oiled machinery of civil society
14-02-2017,unknown,India; France to cooperate in energy sector
15-02-2017,unknown,Rivalry between Indian; Pakistani workers in UK
16-02-2017,unknown,India's prized jewels in foreign capitals
17-02-2017,unknown,Bhutto hails India's role in peace process
21-02-2017,unknown,Kumaratunga ready to open peace talks with LTTE
22-02-2017,unknown,Chaudhry retained as party caucus leader
23-02-2017,unknown,India; Egypt hold talks; to double trade
24-02-2017,unknown,Taliban has legitimised state terrorism: Jaswant
27-02-2017,unknown,Benazir hails India's 'proactive' role in Kashmir
28-02-2017,unknown,Kumaratunga ready to open peace talks with LTTE
01-03-2017,unknown,US Congressional team to visit India; Pakistan
02-03-2017,unknown,PML to challenge arrest of Sharif's nephew
03-03-2017,unknown,Sharif's friend released from detention
06-03-2017,unknown,Goa no longer a safe haven for women
07-03-2017,unknown,Govt has two new schemes for jobless youth
08-03-2017,unknown,WISL sweats it out to get shipshape
09-03-2017,unknown,Company told to tow grounded ship seaward
10-03-2017,unknown,Helmets a must from April
13-03-2017,unknown,Govt encouraging corruption; says Cong leader
14-03-2017,unknown,Man and horse prove their mettle
15-03-2017,unknown,Jumaanji pleases
16-03-2017,unknown,Hearts flutter; pulses soar at Air Race-2001
17-03-2017,unknown,It's payback time for this scientist
20-03-2017,unknown,Now; state will keep an eye on orphanages
21-03-2017,unknown,Bus station a boon for commuters; curse for traders
22-03-2017,unknown,STF has another brush with Veerappan's gang
23-03-2017,unknown,A star before the camera and behind the mike
24-03-2017,unknown,These criminals must get their due
27-03-2017,unknown,How about some Popcorn with a sizzle?
28-03-2017,unknown,IT institute at Hubli soon
29-03-2017,unknown,Say cheese; please
30-03-2017,unknown,Valuables go missing from courier consignments
31-03-2017,unknown,Gujarat badly needs money; medicines
03-04-2017,unknown,His verses are a lament on materialism
04-04-2017,unknown,Hi jil pooney; you're one cool cat; da
05-04-2017,unknown,Cong dismisses BJP demand to expel John
06-04-2017,unknown,Tiny tots adopt grandparents
07-04-2017,unknown,No dearth of chemist shops in city
10-04-2017,unknown,Tale of Two States
11-04-2017,unknown,PMK withdraws support; but govt safe
12-04-2017,unknown,Economic growth may dip below last year's level
13-04-2017,unknown,Bold proposals by advisory panel
17-04-2017,unknown,Raising Gujarat from the rubble
18-04-2017,unknown,Ahmedabad gets back to business; by day
19-04-2017,unknown,They 'bought' enough gelatin to blow up Karnataka
20-04-2017,unknown,B'lore to flex its aviation muscle at Aero India
21-04-2017,unknown,Pesticide plays villain with her dreams
24-04-2017,unknown,City college asked to refund development fee
25-04-2017,unknown,Revised school textbooks from next year
