08-03-2019,unknown,Straight Answers
11-03-2019,unknown,Hanif Kureishi charms audiences at American univ
12-03-2019,unknown,Cancer fatigue: When they just don't have energy
13-03-2019,unknown,Global resolve to fight cancer
14-03-2019,unknown,Hrithik Roshan saves drowning director
15-03-2019,unknown,Madhuri Dixit: Pati badgered for KBC!
18-03-2019,unknown,Sushmita Sen: Engaged to Sanjay?
19-03-2019,unknown,Will 'Grahan' emerge from shadows at box-office?
20-03-2019,unknown,Patiala gharana and an ear for pop music
21-03-2019,unknown,Dharmendra: Terrorist attack!
22-03-2019,unknown,Lata Mangeshkar: Legendary aides!
25-03-2019,unknown,'Yeh Raaste Hain Pyaar Ke' makes new 'inroads'
26-03-2019,unknown,Faizal Khan: Down but Not out!
27-03-2019,unknown,Hrithik Roshan saves drowning director
28-03-2019,unknown,Sushmita Sen: Engaged to Sanjay?
29-03-2019,unknown,Dharmendra: Terrorist attack!
01-04-2019,unknown,PM calls all-party meet on ceasefire today
02-04-2019,unknown,Second will compounds Rajmata's legacy
03-04-2019,unknown,Veteran Communist leader Indrajit Gupta dead
04-04-2019,unknown,Worli-Bandra sea link enters crucial stage
05-04-2019,unknown,PIL challenging ACB bifurcation filed in HC
08-04-2019,unknown,MSEB pegs monthly Enron billing at Rs 500 crore from June
09-04-2019,unknown,'All-aware' Mumbaikars feel strongly about issues
10-04-2019,unknown,How can they impose their views on us?
11-04-2019,unknown,Tracking HIV in 10 minutes!
12-04-2019,unknown,Interative games are just child's play
15-04-2019,unknown,Microsoft faces new Antitrust probe over Corel deal
16-04-2019,unknown,Out-of-work wisdom; and a question of ethics
17-04-2019,unknown,Rana's success and its divine origins
18-04-2019,unknown,Napster stirs...ever so silently
22-04-2019,unknown,Child Power
23-04-2019,unknown,Bollywood bash for 'Gujarat'
24-04-2019,unknown,Salman Khan turns negative
25-04-2019,unknown,Abhishek Bachchan: Quite a prankster!
26-04-2019,unknown,Hrithik Roshan: Close-up and personal!
29-04-2019,unknown,Smita Patil's retrospective draws crowds at Moscow
30-04-2019,unknown,Bollywood bash for 'Gujarat'
01-05-2019,unknown,Hrithik Roshan: Close-up and personal!
02-05-2019,unknown,Abhishek Bachchan: Quite a prankster!
03-05-2019,unknown,Salman Khan turns negative
06-05-2019,unknown,Nepal Parliament adjourned again
07-05-2019,unknown,Fiji commander rules out commitment to court ruling
08-05-2019,unknown,Canadian PM to attend vigil for quake victims
09-05-2019,unknown,Rights watchdog asks UN to probe Taliban 'massacre'
10-05-2019,unknown,Probe ordered into remarks against S.African Indians
13-05-2019,unknown,Talks resumption cannot be conditional: Mubarak
14-05-2019,unknown,British racism and the tale of two Lords
15-05-2019,unknown,UB in talks with bottlers for picking up equity
16-05-2019,unknown,Maruti ropes in Hrithik to promote WagonR
17-05-2019,unknown,Super Cassettes to shut down mineral water business
20-05-2019,unknown,Reserve Bank cuts repo rate to 7.5%
21-05-2019,unknown,BPL focusses on the lower end; creates sub-brands
22-05-2019,unknown,Gujarat Positra Port project seeks Rs 3;200 cr FI loan
23-05-2019,unknown,Postal department plans new services to up revenue
24-05-2019,unknown,Foreign brands may cheer you as import curbs fade away
28-05-2019,unknown,No good news for movie buffs expected from Budget
29-05-2019,unknown,For Australian brothel; its business of pleasure
30-05-2019,unknown,Doves have their way; truce prevails
31-05-2019,unknown,Amanullah; 87 others to apply for Indian visas
03-06-2019,unknown,It's back to the days of protest
04-06-2019,unknown,India Caucus to work for lifting of sanctions
05-06-2019,unknown,Govt makes cut-rate sale of BALCO
06-06-2019,unknown,Mahima Chaudhary: Angry damsel!
07-06-2019,unknown,Sunjay Dutt: Fringe benefits!
10-06-2019,unknown,Rahul: Cutefully yours!
11-06-2019,unknown,Panini Raj Kumar: A new kinda stepping stone!
12-06-2019,unknown,Grammy nominee Scott overwhelmed
13-06-2019,unknown,EVM controversy: EC unfazed by Jaya's petition
14-06-2019,unknown,Bloated bureaucracy empties coffers; stops development
17-06-2019,unknown,Census: Tough task for enumerators
18-06-2019,unknown,Taxation or no? Goa public are anxious
19-06-2019,unknown,There's no use shying away from shyness
20-06-2019,unknown,Govt decision on wards stayed
21-06-2019,unknown,Rs 3 crore for road construction
24-06-2019,unknown,Festival of plays from Feb 26
25-06-2019,unknown,Russia to continue N-fuel supply despite US protest
26-06-2019,unknown,A Billion Mutinies
27-06-2019,unknown,Guarding the Oceans
28-06-2019,unknown,Poem Ahoy
01-07-2019,unknown,The Golden Genome
02-07-2019,unknown,Nirvana is Within Reach of Everyone
03-07-2019,unknown,Double Trouble
05-07-2019,unknown,Sense of Humour
08-07-2019,unknown,Indecent Exposure
09-07-2019,unknown,Straight Answers
10-07-2019,unknown,Active Peace
11-07-2019,unknown,Fiji PMO denies disinterest in charges against Speight
12-07-2019,unknown,Canada to let in 235;000 immigrants in 2002
15-07-2019,unknown,Asia Foundation favors US role in Kashmir dispute
16-07-2019,unknown,US IP worth $300 mn stolen in India: Report
17-07-2019,unknown,Mother Teresa monument near Seattle
18-07-2019,unknown,FBI agent's arrest ends major security breach
19-07-2019,unknown,S.African Indian heads Uruguay mission
22-07-2019,unknown,Russia to continue N-fuel supply despite US protest
23-07-2019,unknown,I-T department looking to widen scope of PAN
24-07-2019,unknown,US IP worth $300 mn stolen in India: Report
25-07-2019,unknown,Will the stock market get a shot in arm?
26-07-2019,unknown,Reebok eyes fitness segment
29-07-2019,unknown,Govt makes cut-rate sale of BALCO
30-07-2019,unknown,Cellphone market abuzz with rising subscriber base
31-07-2019,unknown,Aksh to invest Rs90cr for hiking capacity
01-08-2019,unknown,Bharti Mobile served Rs 477 cr demand notice
02-08-2019,unknown,Ranbaxy; Dade to convert pact into JV
05-08-2019,unknown,Truce to be tried out for 3 more months
06-08-2019,unknown,Enough elbow room for all sides
07-08-2019,unknown,Oppn wants govt to come clean on BALCO deal
08-08-2019,unknown,I-T; UTI spat over interest tax
09-08-2019,unknown,Only 26% Indians are poor; claims plan panel
12-08-2019,unknown,Bengal doctors struggle with killer disease
13-08-2019,unknown,NRI-headed company develops low-cost AIDS test
14-08-2019,unknown,Shed excess weight in a week
15-08-2019,unknown,Mamooty best actor in the Asianet Lux Film Awards
16-08-2019,unknown,Hrithik to enthral capital denizens Friday night
19-08-2019,unknown,Lata Mangeshkar to sing at quake fund raiser
20-08-2019,unknown,Ashutosh Rana: Shiva-ling-ling-ling!
21-08-2019,unknown,Flawed Diplomacy
22-08-2019,unknown,Govt wakes up to keep House promises
23-08-2019,unknown,Bihar headed for a flat budget
26-08-2019,unknown,Cong erred by joining RJD govt; says Rama Pilot
27-08-2019,unknown,Chaitudih mine closed after gas leak
28-08-2019,unknown,Munna's men continue seige on Muzaffarpur hospital
29-08-2019,unknown,Bandh hits life in Bhagalpur
30-08-2019,unknown,Whose mother tongue is Hindi; anyway?
03-09-2019,unknown,Awaiting promotion; top I-T official shifted
04-09-2019,unknown,No arms licence to be issued till panchayat poll
05-09-2019,unknown,Medical Re-registration Bill on the cards
06-09-2019,unknown,Traders feel unsafe at Muzaffarpur
09-09-2019,unknown,12 injured as villagers clash with police
10-09-2019,unknown,State distributors' body stops lifting HLL products
11-09-2019,unknown,Trust to 'give up' leprosy home
12-09-2019,unknown,All that dough
13-09-2019,unknown,Mamooty best actor in the Asianet Lux Film Awards
16-09-2019,unknown,Hrithik to enthral capital denizens Friday night
17-09-2019,unknown,Lata Mangeshkar to sing at quake fund raiser
18-09-2019,unknown,Ashutosh Rana: Shiva-ling-ling-ling!
19-09-2019,unknown,Anupama Verma: The grahan has been wiped off
20-09-2019,unknown,Govinda: All dressed up and nowhere to go?
23-09-2019,unknown,Sunil Shetty: Kyunki saas hee saas hai!
24-09-2019,unknown,Sri Hari's big talks
25-09-2019,unknown,Karnataka officials take to the silver screen
26-09-2019,unknown,Berlin award for Kerala film director praised
27-09-2019,unknown,Cease Fire
30-09-2019,unknown,Transparency Please
01-10-2019,unknown,Age of Art
02-10-2019,unknown,Hard Times; Soft Budget
03-10-2019,unknown,The Many Benefits Of Daily Prayer
04-10-2019,unknown,Coat of Arms
07-10-2019,unknown,Beautiful People
08-10-2019,unknown,Low Rates; High Returns
09-10-2019,unknown,Straight Answers
10-10-2019,unknown,Judicial probe ordered into attack on Gowda's wife
11-10-2019,unknown,Family feud suspected behind acid attack
14-10-2019,unknown,Leave it to God: Deve Gowda
15-10-2019,unknown,Bandh total; Cong worker attacked
16-10-2019,unknown,Alert Sub-Inspector turns saviour
17-10-2019,unknown,Chennamma's surgery today
18-10-2019,unknown,SPG looking into 'lapse'
21-10-2019,unknown,Wildlife as work and passion
22-10-2019,unknown,Govt derives formula to improve SSLC results
23-10-2019,unknown,Bill for unorganised sector on the anvil
24-10-2019,unknown,Maharashtra minister injured in accident
25-10-2019,unknown,Students ask CM to revoke decision on grants cut
28-10-2019,unknown,The salsa was superb; and who's your caterer?
29-10-2019,unknown,Fish out of fresh water
30-10-2019,unknown,The healing touch
31-10-2019,unknown,Let's switch to LPG. It's safe
01-11-2019,unknown,Their bamboo music is hard to beat
04-11-2019,unknown,Just ignore the fine print
05-11-2019,unknown,Vrishabhavathinagar: A village woken up
06-11-2019,unknown,Drug abuse cases on a rise in Bangalore
07-11-2019,entertainment.english.hollywood,Bootmen
08-11-2019,unknown,Survey signals bold steps in Budget
11-11-2019,unknown,Govt may beat a retreat on BALCO
12-11-2019,unknown,Boost for BJP; allies; shock for Congress
13-11-2019,unknown,Six policemen killed in ambush
14-11-2019,unknown,Cricket board clips Bindra's wings by banning him
15-11-2019,unknown,Sushma clamps down on Close-Up ad
18-11-2019,unknown,Karunanidhi rules out tie-up with TMC
19-11-2019,unknown,No official order on prize for tip-offs on Veerappan
20-11-2019,unknown,Residents step up stir for road
21-11-2019,unknown,Big-time dealers set a trap for drug peddlers
22-11-2019,unknown,Sparks fly after Cong leaders dropped from GPC
25-11-2019,unknown,Goa govt bails out coconut farmers
26-11-2019,unknown,Goa in debt by Rs 1;414 cr
27-11-2019,unknown,South Korea woos Goa with big plans
29-11-2019,unknown,Decision is shocking: Sequeira
02-12-2019,unknown,Kerala gets a dream budget that won't work
03-12-2019,unknown,Kerala'll get tipsy if Left returns
04-12-2019,unknown,Darkness in Karnataka as power grid trips
05-12-2019,unknown,Govt withdraws order on cut in college grants
06-12-2019,unknown,Govt revokes suspension of officers
09-12-2019,unknown,Chennamma operated; under intensive care
10-12-2019,unknown,Lokesh confesses; but has no regrets
11-12-2019,unknown,Attack: Nature of inquiry yet to be decided
12-12-2019,unknown,When you nail down MC Hammer
13-12-2019,unknown,Virtual bridge from B'lore to Hollywood is heavy with traffic
16-12-2019,unknown,5-yr-old fights for life after drinking arrack
17-12-2019,unknown,BATF will soldier on for better civic life
18-12-2019,unknown,Is Bangalore moving forward?
19-12-2019,unknown,A different ball game for Nagma now
20-12-2019,unknown,Is Brindavan Gardens losing its charm?
23-12-2019,unknown,Something to smile about
24-12-2019,unknown,The city on a school wall
26-12-2019,unknown,Sudden hot spell won't last long
27-12-2019,unknown,ELRTS plays spoilsport; delays flyover work
30-12-2019,unknown,Industrial unit raided for meter tampering
31-12-2019,unknown,Stress on free; compulsory education for children
02-01-2020,unknown,They help women overcome barrier; achieve success
03-01-2020,unknown,HC admits petition seeking tank's maintainance
06-01-2020,unknown,Lok Ayukta probe into irregularities
07-01-2020,unknown,Kannada film bags award
08-01-2020,unknown,Adventure unlimited at Palace Grounds
09-01-2020,unknown,Yellow line violators make traffic cops see red
10-01-2020,unknown,Animal sacrifice: Maneka wants minister punished
13-01-2020,unknown,'US shouldn't take its advantage for granted'
14-01-2020,unknown,KPTC disrupts power supply for CM's sake
15-01-2020,unknown,Lift block on road; orders minister
16-01-2020,unknown,Centre misusing quake issue to impose tax
17-01-2020,unknown,Rs 995 cr WB aid for developing tanks
21-01-2020,unknown,CM hitch-hikes on bullock-cart
22-01-2020,unknown,'Minister suppressing evacuees' voice'
23-01-2020,unknown,Coop society turns 75
24-01-2020,unknown,Janasabha: The catalyst between people; departments
27-01-2020,unknown,Panel to study pesticide ill-effects
28-01-2020,unknown,JVSL lends sympathetic ear to villagers' woes
29-01-2020,unknown,JD(S) postpones protest convention
30-01-2020,unknown,Secrets of the Sect
31-01-2020,unknown,Pink slips herald nightmare for Indian nerds in US
03-02-2020,unknown,'Swadeshi' Vajpayee role model of modern hunks
04-02-2020,unknown,Govt fails to assist quake-hit industries
05-02-2020,unknown,Surat police arrests eight for killings; robberies
06-02-2020,unknown,Western railway announce special train to clear rush
07-02-2020,unknown,Woman stakes claim to world's smallest Gita
10-02-2020,unknown,Mysterious gas may be hydrogen sulphide
11-02-2020,unknown,Law faculty agitation turns violent
12-02-2020,unknown,Padra investors duped of Rs 1.5 lakh
13-02-2020,unknown,SAIL quarters are on sale
14-02-2020,unknown,Alliances fail to influence voting in by polls
18-02-2020,unknown,Confused Tibetan Buddhists await Karmapa's visit
19-02-2020,unknown,20 Naxalites held in Garhwa in two months
20-02-2020,unknown,Salaries not paid to Sanskrit teachers; staff
21-02-2020,unknown,Cosmopolitanism rooted in community discussed
24-02-2020,unknown,Hooper back to reclaim place in Windies team
25-02-2020,unknown,Govt double-talk gives Veerappan the edge
26-02-2020,unknown,STF nabs close aide of Veerappan
27-02-2020,unknown,Thief throws baby into well
28-02-2020,unknown,17.5 crore phone connections in India by 2010
02-03-2020,unknown,NABARD to loan Rs 1600 cr to Haryana
03-03-2020,unknown,Jacob pays surprise visits to schools; hospital
04-03-2020,unknown,Bibi files fresh application
05-03-2020,unknown,Fuel cell engines to replace petrol and diesel ones
06-03-2020,unknown,The emperor of cricket is dead
09-03-2020,unknown,A Hero for Our Time
10-03-2020,unknown,Civilian deaths swelling J&K militant ranks
11-03-2020,unknown,Sonia harps on a new mantra: Farmanomics
12-03-2020,unknown,Tuition for Sonia
13-03-2020,unknown,IT Crash Course
16-03-2020,unknown,Committee Calamity
17-03-2020,unknown,Coffee or Pot?
18-03-2020,unknown,Retirement Investing
19-03-2020,unknown,Why We Listen to Lies; not to Truth
20-03-2020,unknown,Speed of Life
23-03-2020,unknown,True Love
24-03-2020,unknown,Drugs for Development
25-03-2020,unknown,Straight Answers
26-03-2020,unknown,Roshan Seth throws light on his celluloid career
27-03-2020,unknown,Salman Khan turns negative
30-03-2020,unknown,Anupama Verma: 'Grahan' wiped off!
31-03-2020,unknown,4 held for murder of Malad housewife
01-04-2020,unknown,Accused in gold watch scam given clean chit
02-04-2020,unknown,Chembur-Trombay residents oppose LNG plant
03-04-2020,unknown,Govt figures on AIDS doctored; says Countess
06-04-2020,unknown,Three in race to pick up equity in Leela group
07-04-2020,unknown,HC will hear UTI petition today
08-04-2020,unknown,Why the failure to privatise Balco is harmful?
09-04-2020,unknown,NTPC may curtail supply to BSEB
13-04-2020,unknown,Health dept grapples with irregular appointments
14-04-2020,unknown,Paddy sale; not panchayat poll; bothers them
15-04-2020,unknown,Aap mobile hain; hum confined hain: Laloo to scholars
16-04-2020,unknown,Samata uses by-election result to flay Paswan
17-04-2020,unknown,Govt may privatise closed sugar mills
20-04-2020,unknown,Move to evict people from embankments opposed
21-04-2020,unknown,Breeding of leopard cat in captivity in zoo
22-04-2020,unknown,BIT students on hunger strike
23-04-2020,unknown,Spurt in crime worries Bhagalpur residents
24-04-2020,unknown,Bihar Red Cross to adopt village
27-04-2020,unknown,PU staff stage dharna seeking central pay scales
28-04-2020,unknown,CISF sub-inspector shot dead
29-04-2020,unknown,BRABU Senate okays Rs 195-crore budget
30-04-2020,unknown,AIPWA to take up cudgels on behalf of women
01-05-2020,unknown,Australian plane remains stranded
04-05-2020,unknown,Retirement Investing
05-05-2020,unknown,Mamata chugs along beaten track; spares passengers
06-05-2020,unknown,The Don misses another century
07-05-2020,unknown,Court says Bangla migrants a security threat
08-05-2020,unknown,Delhi; Chennai worst cities to live in: UK survey
11-05-2020,unknown,MPs protest Mamata's frugality with trains
12-05-2020,unknown,Mamata ignores experts at Railways' peril
13-05-2020,unknown,Mamata gives few sops to Bengal
14-05-2020,unknown,Trinamul to make Mamata's gifts a poll plank
15-05-2020,unknown,Reform II gets a jolt with populist Rail budget
18-05-2020,unknown,Pvt role sought in Railways info system
19-05-2020,unknown,Rail budget regressive: Congress
20-05-2020,unknown,Didi has her way
21-05-2020,unknown,Train to Nowhere
22-05-2020,unknown,Phoenix Rising
26-05-2020,unknown,Don of An Era
27-05-2020,unknown,Government by 'Schemes'
28-05-2020,unknown,Get Rid of Desires; Realise Your Self
29-05-2020,unknown,Sense and Census
01-06-2020,unknown,The Planet's Plight
02-06-2020,unknown,Language Problems
03-06-2020,unknown,Tiruvarur set for cyber sufficiency
04-06-2020,unknown,A rare surgery; yet a success story
05-06-2020,unknown,Budget for Growth
08-06-2020,unknown,Straight Answers
09-06-2020,unknown,Cong set to challenge BJP govt in Goa
10-06-2020,unknown,IT to propel tourism to greater heights
11-06-2020,unknown,Implement policy to keep beaches tidy; govt told
12-06-2020,unknown,Panaji DD doors shut on Lata Mangeshkar
15-06-2020,unknown,A common man's Budget
16-06-2020,unknown,Taliban decree may punch gaps in Indian history
17-06-2020,unknown,Blackwill likely US envoy to India
18-06-2020,unknown,Command Performance
19-06-2020,unknown,Toxic Transfer
22-06-2020,unknown,Damned to Fame
23-06-2020,unknown,Economic Slowdown
24-06-2020,unknown,Lent: A Time for Prayer & Good Works
25-06-2020,unknown,Bond with the Bard
26-06-2020,unknown,Human Initiative
29-06-2020,unknown,Straight Answers
30-06-2020,unknown,Cops lied; I was arrested from a house; says Maran
01-07-2020,unknown,Hesistant TMC may join AIADMK alliance
02-07-2020,unknown,PIL against poor transport service in Nilgiris
06-07-2020,unknown,Politicians get ready for party-hopping
07-07-2020,unknown,Spitting in a public place may cost you Rs 5;000
08-07-2020,unknown,Police fail to nab gang of thieves
09-07-2020,unknown,Stolen vehicles recovered; two held
10-07-2020,unknown,New traffic system in Margao hailed
13-07-2020,unknown,In Kannur; 180 killed in five years of Left rule
14-07-2020,unknown,Veerappan may be back in TN or Karnataka
15-07-2020,unknown,A common man's Budget
16-07-2020,unknown,Ayes & Nays
17-07-2020,unknown,Uncommon budgets for the common man
20-07-2020,unknown,Don't use your mobile; traffic cops are watching
21-07-2020,unknown,Govt staff may face retirement before 58
22-07-2020,unknown,18 more ill with gastroenteritis
23-07-2020,unknown,Costs increase pain for kidney patients
24-07-2020,unknown,AIDS wracks her body; but the spirit lives on
27-07-2020,unknown,150 huts gutted in slum fire
28-07-2020,unknown,Patel had tears in his eyes: Krishna
29-07-2020,unknown,A common man's Budget
30-07-2020,unknown,Taliban decree may punch gaps in Indian history
31-07-2020,unknown,Blackwill likely US envoy to India
03-08-2020,unknown,Universal View
04-08-2020,unknown,Command Performance
05-08-2020,unknown,Toxic Transfer
06-08-2020,unknown,Damned to Fame
07-08-2020,unknown,Economic Slowdown
10-08-2020,unknown,Lent: A Time for Prayer & Good Works
11-08-2020,unknown,Bond with the Bard
12-08-2020,unknown,Human Initiative
13-08-2020,unknown,Simpler; Shorter; Smarter
14-08-2020,unknown,Straight Answers
17-08-2020,unknown,Cops lied; I was arrested from a house; says Maran
18-08-2020,unknown,Hesistant TMC may join AIADMK alliance
19-08-2020,unknown,PIL against poor transport service in Nilgiris
20-08-2020,unknown,Politicians get ready for party-hopping
21-08-2020,unknown,Spitting in a public place may cost you Rs 5;000
24-08-2020,unknown,Police fail to nab gang of thieves
25-08-2020,unknown,Stolen vehicles recovered; two held
26-08-2020,unknown,New traffic system in Margao hailed
27-08-2020,unknown,Bishop's prayer for train goes unanswered
28-08-2020,unknown,Savvy Sinha cuts a new deal
31-08-2020,unknown,Markets cheer reform measures
01-09-2020,unknown,Proposals major boost for Corporates
02-09-2020,unknown,Drastic changes proposed in labour laws
03-09-2020,unknown,Defence allocations go up by 13.8%
04-09-2020,unknown,Valuable Lessons
08-09-2020,unknown,Big Pluses; Small Minuses
09-09-2020,unknown,Bearded Thoughts
10-09-2020,unknown,Command Performance
11-09-2020,unknown,Involve the Islamists
14-09-2020,unknown,The Kingdom of God Is Within Each of Us
15-09-2020,unknown,Corn & Porn
16-09-2020,unknown,The Arthashastra
17-09-2020,unknown,A Cocktail that Cures
18-09-2020,unknown,Straight Answers
21-09-2020,unknown,Police in a tizzy over burglaries
22-09-2020,unknown,Positive Budget; says CM
23-09-2020,unknown,Edegra is here to enhance sexual activity
24-09-2020,unknown,HC order to CBI in paedophile case
25-09-2020,unknown,Goan artisans to get more prominence
28-09-2020,unknown,Faleiro seeks Parrikar's resignation
29-09-2020,unknown,Planning board to finalise approach to 10th Plan
30-09-2020,unknown,Pak to start serial production of short-range missiles
01-10-2020,unknown,Pak to start serial production of short-range missiles
02-10-2020,unknown,US asks Taliban to halt desecration of statues
05-10-2020,unknown,Sharifs lose Lahore family house
06-10-2020,unknown,STF nabs one more Veerappan associate
07-10-2020,unknown,SPIC case trial from March 19
08-10-2020,unknown,Onset of lower interest rate regime to boost Co sentiment
09-10-2020,unknown,IT sector is happy; except for the hardware folks
12-10-2020,unknown,Realty sees light at the end of tunnel
13-10-2020,unknown,Bangalore corporates are a happy lot
14-10-2020,unknown,Small investors to be hit hard
15-10-2020,unknown,Human Base pegs on early bird advantage in Japan
16-10-2020,unknown,Network is the business
19-10-2020,entertainment.english.hollywood,Such A Long Journey
20-10-2020,unknown,The Buddha Smiles
21-10-2020,city.delhi,Maneka asks govt to take back land for cow shelter
22-10-2020,unknown,TDP men hack 7 Congress workers to death
23-10-2020,unknown,Azhar fashions second innings in aid of charity
26-10-2020,unknown,In five years; I can turn Mumbai into Gotham city
27-10-2020,unknown,The Power of One
28-10-2020,unknown,Far from the madding crowd
29-10-2020,unknown,Chan and the art of Bonsai
30-10-2020,unknown,Anjolie's World
02-11-2020,unknown,Marriage is my stress buster
03-11-2020,unknown,Five-year Wonder
04-11-2020,unknown,I wish I was'nt attractive
05-11-2020,unknown,We were very much in love and nothing else really mattered
06-11-2020,unknown,The man behind the hot seat
09-11-2020,unknown,Romancing the stone
10-11-2020,unknown,Trick or Treat
11-11-2020,unknown,AIDS should be talked about openly
12-11-2020,unknown,Diva Immaculate
13-11-2020,unknown,What a witch
16-11-2020,unknown,Recycle Jackson
17-11-2020,unknown,Caste Away
18-11-2020,unknown,Straight Answers
19-11-2020,unknown,Brain Gain
20-11-2020,unknown,Deshmukh Triumphs
23-11-2020,unknown,A Prison Primer
24-11-2020,unknown,Bombarding at Bamiyan
25-11-2020,unknown,Joyous Holla Moholla: Celebration of Life
27-11-2020,unknown,Twilight Zone
30-11-2020,unknown,Colours of Spring
01-12-2020,unknown,Priyanka: Setting her sights on the entertainment galaxy!
02-12-2020,unknown,Anupama Verma: No titles for me!
03-12-2020,unknown,Poonam Dhillon: Of 'Holi'days and other fests!
04-12-2020,unknown,Sunil Shetty: Sweet things are made of these!
07-12-2020,unknown,Land value to shoot up in and around city
08-12-2020,unknown,7 Cong workers hacked to death in Guntur dist
09-12-2020,unknown,Corporate hospitals' price war hots up
10-12-2020,unknown,Hail; a new dawn!
11-12-2020,unknown,Expose rocks nation
14-12-2020,unknown,Fernandes offers to quit
15-12-2020,unknown,'It's all in national interest'
16-12-2020,unknown,Market drops; steadies; then gets knocked out again
17-12-2020,unknown,End Of History
18-12-2020,unknown,Vehicle population is soaring in Kerala
21-12-2020,unknown,Grizzly Season
22-12-2020,unknown,Lonely Champions
23-12-2020,unknown,One-track Democracy
24-12-2020,unknown,Strategy for Stability
28-12-2020,unknown,De-Islamizing Islam: The Taliban Project
29-12-2020,unknown,Spring Thoughts
30-12-2020,unknown,Trial of Strength
31-12-2020,unknown,Driven by Sentiment
04-01-2021,unknown,Straight Answers
05-01-2021,unknown,New schemes to boost Goa's culture
06-01-2021,unknown,Official status for Marathi in Goa demanded
07-01-2021,unknown,Preserve ecological balance: Rane
08-01-2021,unknown,Live concert in Panaji on March 19
11-01-2021,unknown,Tourism information centre inaugurated
12-01-2021,unknown,Opportunism guides alliance politics in TN
13-01-2021,unknown,AIADMK to contest 141 seats
14-01-2021,unknown,Tekriwal's resignation causes tremors in Assembly
