04-10-2013,unknown,US leggy chicks to come in hordes
07-10-2013,unknown,Microsoft; Intel line up top-end products for electronics show
08-10-2013,unknown,Khosla among Upside's 25 people to watch in 2001
09-10-2013,unknown,Spending on Net projects may be hit
10-10-2013,unknown,British doctor may be worst mass murderer in modern history
11-10-2013,unknown,British judge reveals threats from racists
14-10-2013,unknown,Clinton urges US Congress to ratify CTBT
15-10-2013,unknown,Blind climber to scale Mt. Everest
16-10-2013,unknown,Does American TV have a realism overdose?
17-10-2013,unknown,Banking community must chalk out new system: Jalan
18-10-2013,unknown,Delhi to host India-EU working group meeting on IT
21-10-2013,unknown,Are green activists the new imperialists
22-10-2013,unknown,Asian auto firms bullish on US market
23-10-2013,unknown,Clinton urges US Congress to ratify CTBT
24-10-2013,unknown,US gets its first multicultural cabinet
25-10-2013,unknown,Indian American couple sentenced for injuries to child
28-10-2013,unknown,Mumbai firm to be sentenced in US
29-10-2013,unknown,Parsi men have failed their women
30-10-2013,unknown,Does American TV have a realism overdose?
31-10-2013,unknown,Transit; port use to top talks during Nepal minister's visit
01-11-2013,unknown,Kuldip Sharma's exit will lead to sea change in policing
04-11-2013,unknown,WREB warns SEBs of north-like tripping
05-11-2013,unknown,Chaotic traffic in Mehsana: Authorities have washed hands
06-11-2013,unknown,MSU gears up for NAAC visit; expects a five-star rating
07-11-2013,unknown,Residents here have invested in bore-wells
08-11-2013,unknown,Need for farmers to become professionals: Expert
11-11-2013,unknown,Aamir Khan: 'Lagaan' ko zabaan do
12-11-2013,unknown,Rajkumar Santoshi: Khan pe khan
13-11-2013,unknown,Kamal Haasan: Hey (Thenali) Ram
14-11-2013,unknown,Darshans show Bollywood a way out of financial woes
15-11-2013,unknown,Latest Hrithik movie could make Canberra a hit
18-11-2013,unknown,The Bali beat goes beyond bhangra
19-11-2013,unknown,Tops to trousers; they're going for gold!
20-11-2013,unknown,Aamir Khan: 'Lagaan' ko zabaan do
21-11-2013,unknown,Rajkumar Santoshi: Khan pe khan
22-11-2013,unknown,Kamal Haasan: Hey (Thenali) Ram
25-11-2013,unknown,Darshans show Bollywood a way out of financial woes
26-11-2013,unknown,German TV admits millionaire show was a sham
27-11-2013,unknown,Parliament suggests resignation of TV official
29-11-2013,unknown,Traffic lights
02-12-2013,unknown,Just one of those faces
03-12-2013,unknown,Steve Waugh looks forward to Indian summer
04-12-2013,unknown,Strong comeback by Shane Warne
05-12-2013,unknown,Cricket board chief means business
06-12-2013,unknown,Sangh Parivar; Babri panel up the ante
09-12-2013,unknown,Frontrunner for key US post seen having Pak tilt
10-12-2013,unknown,Muslims see red over Coke logo
11-12-2013,unknown,Move over Nepal; Casino Goa is here
12-12-2013,unknown,Merit Calling
13-12-2013,unknown,Closures putting financial strain on Delhi Govt
16-12-2013,unknown,42 units to be sealed in phase-II of operation closure
17-12-2013,unknown,Special trains for Kumbh Mela
18-12-2013,unknown,CPM for survey of units
19-12-2013,unknown,NIEPA meet to discuss issue of re-employing retired teachers
20-12-2013,unknown,Such a long journey to the green dispenser
23-12-2013,unknown,Woman fighting for life as 'quack' performed MTP
24-12-2013,unknown,Cold weather puts strain on people with weak hearts
26-12-2013,unknown,Secrecy has no place in democracy; says Sorabjee
27-12-2013,unknown,On the hitlist are the polluting units
30-12-2013,unknown,Driver makes of with cash in employer's Zen
31-12-2013,unknown,Rs 25;000 compensation for 10-yr-old domestic help
02-01-2014,unknown,What can one do about the backache 'epidemic'
03-01-2014,unknown,Criminals beat up family with iron rods
06-01-2014,unknown,Three held for stealing power
07-01-2014,unknown,Road accident toll in Noida was 130 last year
08-01-2014,unknown,Blood donation camp organised
09-01-2014,unknown,The policemen find a new excuse: Television in slums
10-01-2014,unknown,Paramour; accomplice get life term for killing woman
13-01-2014,unknown,Policing the metro: Year-end musings
14-01-2014,unknown,Sangh Parivar; Babri panel up the ante
15-01-2014,unknown,Frontrunner for key US post seen having Pak tilt
16-01-2014,unknown,Muslims see red over Coke logo
17-01-2014,unknown,Move over Nepal; Casino Goa is here
21-01-2014,unknown,Merit Calling
22-01-2014,unknown,Closures putting financial strain on Delhi Govt
23-01-2014,unknown,42 units to be sealed in phase-II of operation closure
24-01-2014,unknown,Special trains for Kumbh Mela
27-01-2014,unknown,CPM for survey of units
28-01-2014,unknown,NIEPA meet to discuss issue of re-employing retired teachers
29-01-2014,unknown,Such a long journey to the green dispenser
30-01-2014,unknown,Woman fighting for life as 'quack' performed MTP
31-01-2014,unknown,Cold weather puts strain on people with weak hearts
03-02-2014,unknown,Secrecy has no place in democracy; says Sorabjee
04-02-2014,unknown,On the hitlist are the polluting units
05-02-2014,unknown,Driver makes of with cash in employer's Zen
06-02-2014,unknown,Rs 25;000 compensation for 10-yr-old domestic help
07-02-2014,unknown,What can one do about the backache 'epidemic'
10-02-2014,unknown,Criminals beat up family with iron rods
11-02-2014,unknown,Three held for stealing power
12-02-2014,unknown,Road accident toll in Noida was 130 last year
13-02-2014,unknown,Blood donation camp organised
14-02-2014,unknown,The policemen find a new excuse: Television in slums
18-02-2014,unknown,Paramour; accomplice get life term for killing woman
19-02-2014,unknown,Policing the metro: Year-end musings
20-02-2014,unknown,Sullied Symbol
21-02-2014,unknown,Sullied Symbol
24-02-2014,unknown,Temple Tactics
25-02-2014,unknown,Conflict Diamonds
26-02-2014,unknown,Vajpayee's Musings
27-02-2014,unknown,Sabarimala; Abode Of Lord Ayyappa
28-02-2014,unknown,Pleasure Principle
03-03-2014,unknown,Concept of Creation
04-03-2014,unknown,I'm just a supporter of LTTE: Nedumaran
05-03-2014,unknown,HAL will showcase its pride at Aero-2001
06-03-2014,unknown,I will prove charges against Mishra: J K Jain
07-03-2014,unknown,Samata faces split over JD merger
10-03-2014,unknown,Cellphone is proving a curse for the mafia
11-03-2014,unknown,The Kamasutra girl is real cool
12-03-2014,unknown,Ayurveda is more than oil massage
13-03-2014,unknown,Balle Balle Boys hit the charts
14-03-2014,unknown,Financier Bharat Shah held for alleged links with Chotta Shakeel
17-03-2014,unknown,Officials brace for millennium's first Mahakumbh
18-03-2014,unknown,Material souls to seek salvation by the Ganga
19-03-2014,unknown,Vajpayee woos Vietnam with infotech
20-03-2014,unknown,All party meet on joint cadre issue soon: CM
21-03-2014,unknown,One more advocate general for Goa soon
24-03-2014,unknown,Order on plastic ban soon
25-03-2014,unknown,Campaign to educate vendors selling cigarette; gutka
26-03-2014,unknown,Hike in water tariff from March
27-03-2014,unknown,Construction of Swatantra Veer Chowk mooted
28-03-2014,unknown,Lunar eclipse on Jan. 9 and 10
31-03-2014,unknown,Hefty phone bill shocks officials
01-04-2014,unknown,50 handicaps to get artificial limbs
02-04-2014,unknown,ABVP organises reception for students
03-04-2014,unknown,Infrastructure development corporation to be constituted
04-04-2014,unknown,Seminar on industrial gases from Jan. 19
07-04-2014,unknown,New molecule to fight malaria found
08-04-2014,unknown,Brain's sensory filter smaller in schizophrenics
09-04-2014,unknown,Mice to blame for childhood asthma?
10-04-2014,unknown,Controlled drinking may be answer for alcoholics
11-04-2014,unknown,No radiation sickness among Bulgarian troops
14-04-2014,unknown,STF is working without sleep; food: Sangliana
15-04-2014,unknown,Danger lurks at most city pubs
16-04-2014,unknown,Centre's ditherings dangerous: Chandra Shekhar
17-04-2014,unknown,New tariffs bad news for cellphone operators
21-04-2014,unknown,Jaya Jaitly unanimously elected Samata chief
22-04-2014,unknown,Bus station at Shivajinagar set to open
23-04-2014,unknown,CM gets a 'majority darshan'
24-04-2014,unknown,CET Cell returns Rs 13 cr to govt
25-04-2014,unknown,Ranebennur tense; bandh successful
28-04-2014,unknown,Britisher found dead
29-04-2014,unknown,Take citizens into your confidence; CM tells police
30-04-2014,unknown,State to crack down on illegal plastic production
01-05-2014,unknown,Krishna reviews matters of his constituency
02-05-2014,unknown,Now JD(S) gives clearance for merger with JD(U)
05-05-2014,unknown,Shoulder injury sends Kumble into a spin
06-05-2014,unknown,Treasury dept to be computerised in year
07-05-2014,unknown,Art exhibition to raise funds for music school
08-05-2014,unknown,Cotton row: Govt open to talks
09-05-2014,unknown,TADA judge issues notices to 10 witnesses
12-05-2014,unknown,Grid problems hits power supply
13-05-2014,unknown,Probe ordered into chick colouring
14-05-2014,unknown,Has it; doesn't flaunt it
15-05-2014,unknown,Falun Gong is free because we can't sell spiritualism
16-05-2014,unknown,Erosion in value system in civil society
19-05-2014,unknown,Contempt notice for disobeying HC order
20-05-2014,unknown,Medical evidences should corroborate charges levelled by victim
21-05-2014,unknown,BCC submits memo in HC
22-05-2014,unknown,The best things in life
23-05-2014,unknown,Superstition; poverty increasing AIDS cases
27-05-2014,unknown,Financier Bharat Shah held for alleged links with Chotta Shakeel
28-05-2014,unknown,Officials brace for millennium's first Mahakumbh
29-05-2014,unknown,Material souls to seek salvation by the Ganga
30-05-2014,unknown,Vajpayee woos Vietnam with infotech
02-06-2014,unknown,All party meet on joint cadre issue soon: CM
03-06-2014,unknown,One more advocate general for Goa soon
04-06-2014,unknown,Order on plastic ban soon
05-06-2014,unknown,Campaign to educate vendors selling cigarette; gutka
06-06-2014,unknown,Hike in water tariff from March
09-06-2014,unknown,Construction of Swatantra Veer Chowk mooted
10-06-2014,unknown,Lunar eclipse on Jan. 9 and 10
11-06-2014,unknown,Hefty phone bill shocks officials
12-06-2014,unknown,50 handicaps to get artificial limbs
13-06-2014,unknown,ABVP organises reception for students
16-06-2014,unknown,Infrastructure development corporation to be constituted
17-06-2014,unknown,Seminar on industrial gases from Jan. 19
18-06-2014,unknown,New molecule to fight malaria found
19-06-2014,unknown,Brain's sensory filter smaller in schizophrenics
20-06-2014,unknown,Mice to blame for childhood asthma?
23-06-2014,unknown,Controlled drinking may be answer for alcoholics
24-06-2014,unknown,No radiation sickness among Bulgarian troops
25-06-2014,unknown,STF is working without sleep; food: Sangliana
26-06-2014,unknown,Danger lurks at most city pubs
27-06-2014,unknown,Centre's ditherings dangerous: Chandra Shekhar
30-06-2014,unknown,New tariffs bad news for cellphone operators
01-07-2014,unknown,Jaya Jaitly unanimously elected Samata chief
02-07-2014,unknown,Bus station at Shivajinagar set to open
03-07-2014,unknown,CM gets a 'majority darshan'
07-07-2014,unknown,CET Cell returns Rs 13 cr to govt
08-07-2014,unknown,Ranebennur tense; bandh successful
09-07-2014,unknown,Britisher found dead
10-07-2014,unknown,Take citizens into your confidence; CM tells police
11-07-2014,unknown,State to crack down on illegal plastic production
14-07-2014,unknown,Krishna reviews matters of his constituency
15-07-2014,unknown,Now JD(S) gives clearance for merger with JD(U)
16-07-2014,unknown,Shoulder injury sends Kumble into a spin
17-07-2014,unknown,Treasury dept to be computerised in year
18-07-2014,unknown,Art exhibition to raise funds for music school
21-07-2014,unknown,Cotton row: Govt open to talks
22-07-2014,unknown,TADA judge issues notices to 10 witnesses
23-07-2014,unknown,Officials brace for millennium's first Mahakumbh
24-07-2014,city.patna,Fend for yourselves; Pande tells doctors
25-07-2014,city.patna,Bureaucracy undermining legislature's 'existence'
28-07-2014,city.patna,State police collapses under pressure
29-07-2014,city.patna,Court declares Pappu Yadav an absconder
30-07-2014,unknown,Sonia takes on the Hindutva brigade
31-07-2014,unknown,Congress hopes soar; BJP cries foul
01-08-2014,unknown,Ceasefire decision likely today
04-08-2014,unknown,Ceasefire blues: To end or extend truce
05-08-2014,unknown,So Young; So Successful
06-08-2014,unknown,Straight Answers
07-08-2014,unknown,Kumbh Karma
08-08-2014,unknown,Greenmail & White Knights
11-08-2014,unknown,Child of Fortune
12-08-2014,unknown,One-way Street
13-08-2014,unknown,Towards a Theory of Everything - II
14-08-2014,unknown,Seeing is Believing
15-08-2014,unknown,Meditation
18-08-2014,unknown,Wockhardt plans another cardiac centre
19-08-2014,unknown,Inside Track
20-08-2014,unknown,CM for action against officials depositing funds in non-scheduled banks
21-08-2014,unknown,Blood donation no more safe in hospitals
22-08-2014,unknown,BJP asks govt to learn lessons from 'failed MoUs'
25-08-2014,unknown,Surveillance along coastal belt stepped up
26-08-2014,unknown,Cong opposes Vaze as GPSC chief
27-08-2014,unknown,Minister to verify info on Goans in star hotels
28-08-2014,unknown,Tillari: Rehabilitation first; says Oppn
29-08-2014,unknown,Rape accused acquitted
02-09-2014,unknown,Milk price hike: Govt to do a rethink
03-09-2014,unknown,Career information fair from Feb 17
04-09-2014,unknown,Assembly congratulates Anil Kakodkar
05-09-2014,unknown,Multi-religious meet held
08-09-2014,unknown,Kirti is Reddy for 'Pyaar Ishq Aur Mohabbat'!
09-09-2014,unknown,Nasir Khan: Small to big!
10-09-2014,unknown,Pooja Batra: Curry on Pooja!
11-09-2014,unknown,Shamita Shetty: 'Mohabbat' all the way
12-09-2014,unknown,Pankaj Udhas: Technological voices!
15-09-2014,unknown,Kirti is Reddy for 'Pyaar Ishq Aur Mohabbat'!
16-09-2014,unknown,Pankaj Udhas: Technological voices!
17-09-2014,unknown,Pooja Batra: Curry on Pooja!
18-09-2014,unknown,Shamita Shetty: 'Mohabbat' all the way
19-09-2014,unknown,Nasir Khan: Small to big!
22-09-2014,unknown,Bajaj Auto to sell 26% in tempo arm; withdraw name
23-09-2014,unknown,Timex to create new image with 180 models
24-09-2014,unknown,Kawasaki to re-negotiate stake purchase
25-09-2014,unknown,NIIT net seen up 50 per cent at Rs 27 crore
26-09-2014,unknown,Now; imported products need to meet Indian standard
29-09-2014,unknown,Branded jewellery set to dazzle some more
30-09-2014,unknown,Net familiarity will drive e-commerce
01-10-2014,unknown,Net familiarity will drive e-commerce
02-10-2014,unknown,Digitalising consultancy at Orbit-e
03-10-2014,unknown,Way2Wealth positions as one-stop financial shop
06-10-2014,unknown,Govt to table 13 bills in ongoing assembly session
07-10-2014,unknown,Cong leaders asked to decide on tie with Trinamul
08-10-2014,unknown,CPM interference in agriculture varsity
09-10-2014,unknown,Nation-wide red alert regarding toxic tea
10-10-2014,unknown,Viren Shah 'out-walks' the Opposition
13-10-2014,unknown,Highlights of Viren J. Shah's speech
14-10-2014,unknown,Sramik Union supports Baranagar mill violence
15-10-2014,unknown,CMC seeks police help to protect statues
16-10-2014,unknown,Increase in Haj pilgrims from state
17-10-2014,unknown,'Withholding teachers' salaries was collective decision'
20-10-2014,unknown,Ceasefire camouflages factional strife in Nagaland
21-10-2014,unknown,NHRC issues notice to WB home secy
22-10-2014,unknown,Protest against port in Kulpi
23-10-2014,unknown,Mamata to attend police body meet today
24-10-2014,unknown,'Empowered' women of Kochpukur impress Lara
27-10-2014,unknown,Medical college for Sikkim by July
28-10-2014,unknown,Govt extends J&K ceasefire by a month
29-10-2014,unknown,Peace hinges on human rights
30-10-2014,unknown,Two crore at Mahakumbh for the big bath
31-10-2014,unknown,Minister inquired about Hinduja passport; admits UK
03-11-2014,unknown,First R&D; then food for all
04-11-2014,unknown,Globo God
05-11-2014,unknown,Pilgrim's Process
06-11-2014,unknown,Sustainable Ceasefire
07-11-2014,unknown,Beauty and the Beast
10-11-2014,unknown,Urban Apartheid
11-11-2014,unknown,Spiritual Quotient Leverages IQ & EQ
12-11-2014,unknown,The Veggie Abroad
13-11-2014,unknown,Purifying Ourselves
14-11-2014,unknown,Labour of Law
17-11-2014,unknown,Straight Answers
18-11-2014,unknown,Boby's fight for love
19-11-2014,unknown,Dharmendra: Suicide Suicide!
20-11-2014,unknown,Sunny Deol: Lessons Learned!
21-11-2014,unknown,British Indian to present Kama Sutra series
24-11-2014,unknown,Farouq Rattonsey: Third Time Lucky?
25-11-2014,unknown,Welfare fund for film artistes
26-11-2014,unknown,Our department is life
28-11-2014,unknown,Bitter reality bared
01-12-2014,unknown,Keep danbruff at an arms distance
02-12-2014,unknown,Awareness is essential
03-12-2014,unknown,A Fashion excuse
04-12-2014,unknown,Plane mishap averted at Patna
05-12-2014,unknown,Two CPI(ML) activists die in Gaya police firing
08-12-2014,unknown,Gold gifts to Misa may trouble their presenters
09-12-2014,unknown,Police hesitant in lodging case against Sadhu; Modi
10-12-2014,unknown,CPI decides to continue agitation
11-12-2014,unknown,Jharkhand govt to set up own power grid
12-12-2014,unknown,Minister warns banks of economic non-cooperation
15-12-2014,unknown,Dalit outfits to hold rally before HC
16-12-2014,unknown,Court asks DG to travel on highways in Bihar
17-12-2014,unknown,3 cellphones recovered from Muzaffarpur jail
18-12-2014,unknown,Trader was freed on payment of Rs 2.5 crore
19-12-2014,unknown,Samata's Kurmi card on test in Asthawa
22-12-2014,unknown,Govt to seek fresh cadre option from staff
23-12-2014,unknown,LNMU V-C cancels teachers' deputation to town colleges
24-12-2014,unknown,Shamiana replaces exam halls
26-12-2014,unknown,Cellphone services at loggerheads in Patna
29-12-2014,unknown,Concentrate on developmental activities: Naidu
30-12-2014,unknown,TDP will not rock NDA boat: Naidu
31-12-2014,unknown,Noose tightens for those causing noise pollution
02-01-2015,unknown,Centre to give big push to herbal sector
05-01-2015,unknown,Big bath passes without a hitch
06-01-2015,unknown,Security bandobast: The one that got away
07-01-2015,unknown,Enron allowed to enhance stake in Dhabol project
08-01-2015,unknown,Govt has discretionary powers to deny passports
09-01-2015,unknown,A view from far and near
12-01-2015,unknown,'Temptation Island' beats 'The Mole'
13-01-2015,unknown,Kasparov drubs Shirov; takes joint lead
14-01-2015,unknown,Dino Morrea: Bhatt; seriously!
15-01-2015,unknown,Kabhi Insured Kabhi Nahi!
16-01-2015,unknown,'Samosa Queen' among richest UK businesswomen
20-01-2015,unknown,Ustad Zakir Hussain: Drumming high
21-01-2015,unknown,Priyadarshan: Angrezi Babu?
22-01-2015,unknown,Dino Morrea: Bhatt; seriously!
23-01-2015,unknown,Ministers under threat
26-01-2015,unknown,A wait in vain for our young neighbours?
27-01-2015,unknown,No tableaux yet from brand-new states
28-01-2015,unknown,Birds pecking at meatshop waste may disrupt flypast
29-01-2015,unknown,DDA take responsibility for power; water in its properties: Court
30-01-2015,unknown,How much longer; SC asks govt
02-02-2015,unknown,The court has faith in us: Jagmohan
03-02-2015,unknown,MCD begins the clean-up act
04-02-2015,unknown,Illegal arms flood Delhi
05-02-2015,unknown,Killer roads claim more; 7 dead in 24 hrs
06-02-2015,unknown,Link between Noida-South Delhi slashes distances
09-02-2015,unknown,Tax doubles Noida schoolbus fee; parents upset
10-02-2015,unknown,Dancing is a pleasure; but give us hot food and water; say artistes
11-02-2015,unknown,IPI world congress comes back to India
12-02-2015,unknown,No monkey business this: A sarkari simian safari
13-02-2015,unknown,Cough's not good; it could damage your heart
17-02-2015,unknown,Keep the dress code light-coloured
18-02-2015,unknown,Man gets life term for burning mother to death
19-02-2015,unknown,Of long hours and short fuses...
20-02-2015,unknown,Steve Waugh yet to speak to brother on matchfixing
23-02-2015,unknown,Aussies play Mumbai at Brabourne; Cammie Smith match referee
24-02-2015,unknown,Kumble's absence may encourage youngsters: Dravid
25-02-2015,unknown,Chris Cairns to undergo surgery
26-02-2015,unknown,Aussies play Mumbai at Brabourne; Cammie Smith match referee
27-02-2015,unknown,Stage set for France's first final in 63 years
02-03-2015,unknown,Stage set for France's first final in 63 years
03-03-2015,unknown,Agassi prepares to face Rafter in semifinal
04-03-2015,unknown,Gift to a bride
05-03-2015,unknown,Will the Chinese kill us ?
06-03-2015,unknown,The sound of Alabina
09-03-2015,unknown,Municipal staff storm Commissioner's office
10-03-2015,unknown,Cong to come out with 'black papers'
11-03-2015,unknown,Strategy papers are far fetched: Cong; CPI
12-03-2015,unknown,Organised Crime Act as good as TADA
13-03-2015,unknown,Austech plans mini IT university in Punjab
16-03-2015,unknown,Police bust 3 member gang of burglars
17-03-2015,unknown,Surjewala blames govt for inflation
18-03-2015,unknown,Congress hopeful of winning Majitha seat
19-03-2015,unknown,SGPC appoints new in charge of its sub office
20-03-2015,unknown,Displaced Slum-dwellers force HUDA to allot alternative site
23-03-2015,unknown,Haryana to sell surplus land; buildings for capital fund
24-03-2015,unknown,No breakthrough in Panchkula double murder
25-03-2015,unknown,Chautala lays stone of Sinchai Bhawan
26-03-2015,unknown,Congress seeks to upset SAD applecart in Majitha by-poll
27-03-2015,unknown,Suspected infiltration; PU hostel raided
30-03-2015,unknown,A night of terror at Saketri
31-03-2015,unknown,UBS faculty wants financial autonomy
01-04-2015,unknown,AIDS assuming epidemic proportions
02-04-2015,unknown,New life styles; food habits to blame for heart disease
06-04-2015,unknown,Complaint against hospital dismissed
07-04-2015,unknown,Ashadeep lends IGMC a helping hand
08-04-2015,unknown,Haryana gets ready for PM's visit
09-04-2015,unknown,CBSE evinces interest in UT weekly tests programme
10-04-2015,unknown,The life-style disease leads to blindness
13-04-2015,unknown,'Wireless data networks necessary for reliable connectivity in inaccessible areas
14-04-2015,unknown,Road to Rly station from highway to be closed for city traffic
15-04-2015,unknown,Rice miller nabbed
16-04-2015,unknown,New Article'Inside or outside; two-wheeler are unsafe'
17-04-2015,unknown,Zero Slum Game
20-04-2015,unknown,Exit Estrada
21-04-2015,unknown,Kabhi Cushy; Kabhi Grim
22-04-2015,unknown,President against pitch for indirect polls
23-04-2015,unknown,TRAI orders refund of crores to cellphone users
24-04-2015,unknown,Soccer helps heal the wounds of war
27-04-2015,unknown,Settlur grilled over affair with Becker
28-04-2015,unknown,'KBC': nothing compares to you!
29-04-2015,unknown,Raveena Tandon in Noorani's 'Dreamcatcher'
30-04-2015,unknown,Sunny Deol: his 'dillagi' towards 'Indian'!
01-05-2015,unknown,Recipe from Anil Kapoor's cook book!
04-05-2015,unknown,Yash Pathak: Wonder boy!
05-05-2015,unknown,Chandrasekhar comedy; a Sundance festival hit
06-05-2015,unknown,Kiran Bedi dons a new role to promote love
07-05-2015,unknown,Inquiry net on Hinduja citizenship widens
08-05-2015,unknown,Mendonca's powers curtailed
11-05-2015,unknown,SP; JD (S) Muslim members are set to join NCP
12-05-2015,unknown,Navi Mumbai witnessed fall in crime in 2000
13-05-2015,unknown,Miss India pageant showcases mermaids in wonderworld
14-05-2015,unknown,Mumbai's youth is gung-ho about India
15-05-2015,unknown,Straight Answers
18-05-2015,unknown,New car pool portal to solve traffic chaos
19-05-2015,unknown,Competition spurs LIC to market-linked policy
20-05-2015,unknown,HC wants rules framed for appointment of trustees
21-05-2015,unknown,AI undecided over installing new TV sets
22-05-2015,unknown,Hawking's disabilities were the focus of publicity
26-05-2015,unknown,Sahitya sammelans conveyed opposite ideologies
27-05-2015,unknown,UN report warns of global warming
28-05-2015,unknown,Tea can protect you from heart ailments; diabetes
29-05-2015,unknown,Indian fashion will continue
01-06-2015,unknown,Is Movie Tower haunted?
02-06-2015,unknown,Imprisonment taking toll of Speight
03-06-2015,unknown,Bush inaugural evokes strong feelings among Indians
04-06-2015,unknown,Physicist's endowment funds Indo-US nuclear talks
05-06-2015,unknown,Human rights beyond legal framework: Amartya Sen
08-06-2015,unknown,US citizens in Nepal may be targeted by Maoists
09-06-2015,unknown,Nepali minister resigns over airline lease scam
10-06-2015,unknown,Indo-Bangla passenger train service soon
11-06-2015,unknown,Pressure to continue on Tigers: Wickremanayake
12-06-2015,unknown,Muslim minister strikes deal with Kumaratunga
15-06-2015,unknown,Monster quake kills over 15;000
16-06-2015,unknown,Daddy see; the balcony is shaking...
17-06-2015,unknown,Forces to the rescue
18-06-2015,unknown,Monster quake kills 4;000
19-06-2015,unknown,Forces to the rescue
22-06-2015,unknown,Centre promises all aid
23-06-2015,unknown,PM appeals for help
24-06-2015,unknown,Daddy see; the balcony is shaking...
25-06-2015,unknown,The unpredictable calamity
26-06-2015,unknown,British promoter Jonathan King faces sex charges
29-06-2015,unknown,Shah Rukh Khan: Sporting a spirit
30-06-2015,unknown,Rani Mukherjee: Chi chi fancies
01-07-2015,unknown,Keerthi Reddy: Still more jadoo to do?
02-07-2015,unknown,Let's Cell-eberate
06-07-2015,unknown,A True Republican
